name,rating,price,socket/cpu,form factor,memory max,memory slots,link
MSI B650 GAMING PLUS WIFI ATX AM5 Motherboard,,$179.99,AM5,ATX,192 GB,4,https://www.amazon.com/dp/B0CB6XZ7RH?tag=bgfg-pc-builder-us-20
MSI MAG B650 TOMAHAWK WIFI ATX AM5 Motherboard,4.0,$259.99,AM5,ATX,128 GB,4,https://www.amazon.com/s?k=MSI+MAG+B650+TOMAHAWK+WIFI+ATX+AM5+Motherboard&tag=bgfg-pc-builder-us-20
MSI B550 GAMING GEN3 ATX AM4 Motherboard,,$112.99,AM4,ATX,128 GB,4,https://www.amazon.com/dp/B0BHCL4YVS?tag=bgfg-pc-builder-us-20
Gigabyte B650 EAGLE AX ATX AM5 Motherboard,,$159.99,AM5,ATX,192 GB,4,https://www.amazon.com/dp/B083TZ68H1?tag=bgfg-pc-builder-us-20
Gigabyte X870E AORUS ELITE WIFI7 ATX AM5 Motherboard,5.0,$319.99,AM5,ATX,256 GB,4,https://www.amazon.com/dp/B0DGVBM73J?tag=bgfg-pc-builder-us-20
Asus PRIME B550M-A WIFI II Micro ATX AM4 Motherboard,,$158.99,AM4,Micro ATX,128 GB,4,https://www.amazon.com/dp/B0B5M97W1T?tag=bgfg-pc-builder-us-20
MSI B760 GAMING PLUS WIFI ATX LGA1700 Motherboard,,$159.99,LGA1700,ATX,192 GB,4,https://www.amazon.com/dp/B0C15THTK7?tag=bgfg-pc-builder-us-20
MSI PRO B650-S WIFI ATX AM5 Motherboard,,,AM5,ATX,192 GB,4,https://www.amazon.com/s?k=MSI+PRO+B650-S+WIFI+ATX+AM5+Motherboard&tag=bgfg-pc-builder-us-20
MSI MAG X870 TOMAHAWK WIFI ATX AM5 Motherboard,,$299.99,AM5,ATX,256 GB,4,https://www.amazon.com/dp/B0DG3HK897?tag=bgfg-pc-builder-us-20
MSI B550M PRO-VDH WIFI Micro ATX AM4 Motherboard,4.7,$119.99,AM4,Micro ATX,128 GB,4,https://www.amazon.com/dp/B089D1YG11?tag=bgfg-pc-builder-us-20
Gigabyte X870 EAGLE WIFI7 ATX AM5 Motherboard,,$229.99,AM5,ATX,256 GB,4,https://www.amazon.com/dp/B0DGVMYTW6?tag=bgfg-pc-builder-us-20
MSI PRO B650M-P Micro ATX AM5 Motherboard,,$119.99,AM5,Micro ATX,192 GB,4,https://www.amazon.com/dp/B0C7SJFDXK?tag=bgfg-pc-builder-us-20
Asus ROG STRIX B650-A GAMING WIFI ATX AM5 Motherboard,,$279.99,AM5,ATX,128 GB,4,https://www.amazon.com/dp/B0BHMW8R6S?tag=bgfg-pc-builder-us-20
Gigabyte A520M K V2 Micro ATX AM4 Motherboard,,$77.50,AM4,Micro ATX,64 GB,2,https://www.amazon.com/dp/B0BXFBN121?tag=bgfg-pc-builder-us-20
MSI MAG B550 TOMAHAWK MAX WIFI ATX AM4 Motherboard,5.0,$198.99,AM4,ATX,128 GB,4,https://www.amazon.com/s?k=MSI+MAG+B550+TOMAHAWK+MAX+WIFI+ATX+AM4+Motherboard&tag=bgfg-pc-builder-us-20
MSI PRO Z790-A MAX WIFI ATX LGA1700 Motherboard,,$259.99,LGA1700,ATX,192 GB,4,https://www.amazon.com/dp/B0CJSJ9TB3?tag=bgfg-pc-builder-us-20
Asus Prime B450M-A II Micro ATX AM4 Motherboard,4.5,$79.98,AM4,Micro ATX,128 GB,4,https://www.amazon.com/dp/B08KH12V25?tag=bgfg-pc-builder-us-20
Gigabyte B550M K Micro ATX AM4 Motherboard,,$89.99,AM4,Micro ATX,128 GB,4,https://www.amazon.com/s?k=Gigabyte+B550M+K+Micro+ATX+AM4+Motherboard&tag=bgfg-pc-builder-us-20
Gigabyte X870E AORUS PRO ICE ATX AM5 Motherboard,,$359.99,AM5,ATX,256 GB,4,https://www.amazon.com/dp/B0DGVBSLLP?tag=bgfg-pc-builder-us-20
ASRock B650M Pro RS WiFi Micro ATX AM5 Motherboard,5.0,$149.99,AM5,Micro ATX,192 GB,4,https://www.amazon.com/s?k=ASRock+B650M+Pro+RS+WiFi+Micro+ATX+AM5+Motherboard&tag=bgfg-pc-builder-us-20
Asus ROG STRIX Z790-A GAMING WIFI II ATX LGA1700 Motherboard,,$359.99,LGA1700,ATX,192 GB,4,https://www.amazon.com/dp/B0CJMR6652?tag=bgfg-pc-builder-us-20
Asus TUF GAMING B650-PLUS WIFI ATX AM5 Motherboard,5.0,$239.99,AM5,ATX,128 GB,4,https://www.amazon.com/dp/B0BHN7GGBQ?tag=bgfg-pc-builder-us-20
Asus ROG STRIX B550-F GAMING WIFI II ATX AM4 Motherboard,5.0,$191.99,AM4,ATX,128 GB,4,https://www.amazon.com/dp/B09GP7P1XS?tag=bgfg-pc-builder-us-20
MSI MAG X670E TOMAHAWK WIFI ATX AM5 Motherboard,,,AM5,ATX,128 GB,4,https://www.amazon.com/s?k=MSI+MAG+X670E+TOMAHAWK+WIFI+ATX+AM5+Motherboard&tag=bgfg-pc-builder-us-20
MSI PRO B550M-VC WIFI Micro ATX AM4 Motherboard,4.8,$109.99,AM4,Micro ATX,128 GB,4,https://www.amazon.com/dp/B0BDCZRBD6?tag=bgfg-pc-builder-us-20
ASRock B650M PG Lightning Wifi Micro ATX AM5 Motherboard,,,AM5,Micro ATX,192 GB,4,https://www.amazon.com/s?k=ASRock+B650M+PG+Lightning+Wifi+Micro+ATX+AM5+Motherboard&tag=bgfg-pc-builder-us-20
Gigabyte X870 AORUS ELITE WIFI7 ICE ATX AM5 Motherboard,,$289.99,AM5,ATX,256 GB,4,https://www.amazon.com/dp/B0DGVGRVLQ?tag=bgfg-pc-builder-us-20
Asus ROG STRIX B650E-F GAMING WIFI ATX AM5 Motherboard,,$299.99,AM5,ATX,128 GB,4,https://www.amazon.com/dp/B0BHMTYZKZ?tag=bgfg-pc-builder-us-20
ASRock X870 Pro RS WiFi ATX AM5 Motherboard,5.0,$269.99,AM5,ATX,256 GB,4,https://www.amazon.com/dp/B0DGB9VXRY?tag=bgfg-pc-builder-us-20
MSI B550-A PRO ATX AM4 Motherboard,4.8,$139.99,AM4,ATX,128 GB,4,https://www.amazon.com/dp/B089CZSQB4?tag=bgfg-pc-builder-us-20
Gigabyte B650M GAMING PLUS WF Micro ATX AM5 Motherboard,,$154.99,AM5,Micro ATX,192 GB,4,https://www.amazon.com/s?k=Gigabyte+B650M+GAMING+PLUS+WF+Micro+ATX+AM5+Motherboard&tag=bgfg-pc-builder-us-20
ASRock B660M Pro RS Micro ATX LGA1700 Motherboard,,$107.49,LGA1700,Micro ATX,128 GB,4,https://www.amazon.com/dp/B09NZPD6WD?tag=bgfg-pc-builder-us-20
ASRock A620I LIGHTNING WIFI Mini ITX AM5 Motherboard,,,AM5,Mini ITX,96 GB,2,https://www.amazon.com/s?k=ASRock+A620I+LIGHTNING+WIFI+Mini+ITX+AM5+Motherboard&tag=bgfg-pc-builder-us-20
Gigabyte X870 AORUS ELITE WIFI7 ATX AM5 Motherboard,,$289.99,AM5,ATX,256 GB,4,https://www.amazon.com/dp/B0DGVC3DDW?tag=bgfg-pc-builder-us-20
Asus ROG STRIX X870E-E GAMING WIFI ATX AM5 Motherboard,,$469.99,AM5,ATX,192 GB,4,https://www.amazon.com/dp/B0DDZNZF76?tag=bgfg-pc-builder-us-20
Gigabyte B650 AORUS ELITE AX ATX AM5 Motherboard,4.6,$229.99,AM5,ATX,128 GB,4,https://www.amazon.com/dp/B0BH7GTY9C?tag=bgfg-pc-builder-us-20
MSI PRO H610M-G DDR4 Micro ATX LGA1700 Motherboard,,$89.99,LGA1700,Micro ATX,64 GB,2,https://www.amazon.com/dp/B09PX326Q8?tag=bgfg-pc-builder-us-20
Gigabyte B550M AORUS ELITE AX Micro ATX AM4 Motherboard,,,AM4,Micro ATX,128 GB,4,https://www.amazon.com/s?k=Gigabyte+B550M+AORUS+ELITE+AX+Micro+ATX+AM4+Motherboard&tag=bgfg-pc-builder-us-20
Gigabyte B650 AORUS ELITE AX ICE ATX AM5 Motherboard,,$219.99,AM5,ATX,192 GB,4,https://www.amazon.com/dp/B0CMJSH15D?tag=bgfg-pc-builder-us-20
Asus ROG CROSSHAIR X870E HERO ATX AM5 Motherboard,,$699.99,AM5,ATX,192 GB,4,https://www.amazon.com/dp/B0DDZSP2BG?tag=bgfg-pc-builder-us-20
Gigabyte B650 GAMING X AX V2 ATX AM5 Motherboard,4.5,$189.99,AM5,ATX,192 GB,4,https://www.amazon.com/dp/B0CTTY491F?tag=bgfg-pc-builder-us-20
Asus ROG STRIX X870-A GAMING WIFI ATX AM5 Motherboard,,$329.99,AM5,ATX,192 GB,4,https://www.amazon.com/dp/B0DF12WKQY?tag=bgfg-pc-builder-us-20
MSI PRO A620M-E Micro ATX AM5 Motherboard,,$74.98,AM5,Micro ATX,96 GB,2,https://www.amazon.com/dp/B0C15SRJNM?tag=bgfg-pc-builder-us-20
ASRock B650I Lightning Wifi Mini ITX AM5 Motherboard,5.0,,AM5,Mini ITX,96 GB,2,https://www.amazon.com/s?k=ASRock+B650I+Lightning+Wifi+Mini+ITX+AM5+Motherboard&tag=bgfg-pc-builder-us-20
MSI MPG X870E CARBON WIFI ATX AM5 Motherboard,5.0,$499.99,AM5,ATX,256 GB,4,https://www.amazon.com/dp/B0DG3QW9TJ?tag=bgfg-pc-builder-us-20
MSI PRO B650M-A WIFI Micro ATX AM5 Motherboard,,$219.01,AM5,Micro ATX,128 GB,4,https://www.amazon.com/dp/B0BHBZRW66?tag=bgfg-pc-builder-us-20
Asus TUF GAMING B550-PLUS WIFI II ATX AM4 Motherboard,5.0,$167.99,AM4,ATX,128 GB,4,https://www.amazon.com/dp/B09K4QMPL9?tag=bgfg-pc-builder-us-20
Asus TUF GAMING X870-PLUS WIFI ATX AM5 Motherboard,,$274.99,AM5,ATX,192 GB,4,https://www.amazon.com/dp/B0DGB8Q19Y?tag=bgfg-pc-builder-us-20
Asus PRIME B650-PLUS WIFI ATX AM5 Motherboard,,$139.99,AM5,ATX,192 GB,4,https://www.amazon.com/dp/B0DGWQ128D?tag=bgfg-pc-builder-us-20
Gigabyte X870I AORUS PRO ICE Mini ITX AM5 Motherboard,,,AM5,Mini ITX,128 GB,2,https://www.amazon.com/s?k=Gigabyte+X870I+AORUS+PRO+ICE+Mini+ITX+AM5+Motherboard&tag=bgfg-pc-builder-us-20
Gigabyte Z790 EAGLE AX ATX LGA1700 Motherboard,,$199.99,LGA1700,ATX,192 GB,4,https://www.amazon.com/dp/B0CTNPZLNH?tag=bgfg-pc-builder-us-20
MSI A520M-A PRO Micro ATX AM4 Motherboard,5.0,$77.73,AM4,Micro ATX,64 GB,2,https://www.amazon.com/dp/B08HHMCCXV?tag=bgfg-pc-builder-us-20
Gigabyte B760M GAMING PLUS WIFI DDR4 Micro ATX LGA1700 Motherboard,,$144.99,LGA1700,Micro ATX,128 GB,4,https://www.amazon.com/s?k=Gigabyte+B760M+GAMING+PLUS+WIFI+DDR4+Micro+ATX+LGA1700+Motherboard&tag=bgfg-pc-builder-us-20
Asus TUF GAMING B650-E WIFI ATX AM5 Motherboard,,,AM5,ATX,192 GB,4,https://www.amazon.com/s?k=Asus+TUF+GAMING+B650-E+WIFI+ATX+AM5+Motherboard&tag=bgfg-pc-builder-us-20
MSI B450M PRO-VDH MAX Micro ATX AM4 Motherboard,4.3,$84.99,AM4,Micro ATX,64 GB,4,https://www.amazon.com/dp/B07XH629TV?tag=bgfg-pc-builder-us-20
Gigabyte B550 GAMING X V2 ATX AM4 Motherboard,4.5,$179.99,AM4,ATX,128 GB,4,https://www.amazon.com/dp/B08LGKGBKT?tag=bgfg-pc-builder-us-20
ASRock B760M PG Riptide Wifi Micro ATX LGA1700 Motherboard,,,LGA1700,Micro ATX,192 GB,4,https://www.amazon.com/s?k=ASRock+B760M+PG+Riptide+Wifi+Micro+ATX+LGA1700+Motherboard&tag=bgfg-pc-builder-us-20
MSI PRO X870-P WIFI ATX AM5 Motherboard,,$239.99,AM5,ATX,256 GB,4,https://www.amazon.com/dp/B0DG3SSGLF?tag=bgfg-pc-builder-us-20
Asus ROG STRIX Z790-E GAMING WIFI II ATX LGA1700 Motherboard,5.0,$499.99,LGA1700,ATX,192 GB,4,https://www.amazon.com/dp/B0CJMQ2S5M?tag=bgfg-pc-builder-us-20
MSI PRO B760-P WIFI DDR4 ATX LGA1700 Motherboard,,$169.99,LGA1700,ATX,128 GB,4,https://www.amazon.com/dp/B0BRQSWSFQ?tag=bgfg-pc-builder-us-20
Gigabyte B450M DS3H WIFI Micro ATX AM4 Motherboard,3.9,$81.98,AM4,Micro ATX,64 GB,4,https://www.amazon.com/s?k=Gigabyte+B450M+DS3H+WIFI+Micro+ATX+AM4+Motherboard&tag=bgfg-pc-builder-us-20
Asus ROG STRIX B650E-I GAMING WIFI Mini ITX AM5 Motherboard,,$329.99,AM5,Mini ITX,64 GB,2,https://www.amazon.com/s?k=Asus+ROG+STRIX+B650E-I+GAMING+WIFI+Mini+ITX+AM5+Motherboard&tag=bgfg-pc-builder-us-20
MSI MEG X870E GODLIKE EATX AM5 Motherboard,,,AM5,EATX,256 GB,4,https://www.amazon.com/s?k=MSI+MEG+X870E+GODLIKE+EATX+AM5+Motherboard&tag=bgfg-pc-builder-us-20
Gigabyte Z790 AORUS ELITE AX ATX LGA1700 Motherboard,5.0,$499.99,LGA1700,ATX,128 GB,4,https://www.amazon.com/dp/B0BH9DXY38?tag=bgfg-pc-builder-us-20
MSI MPG B550 GAMING PLUS ATX AM4 Motherboard,4.7,$159.99,AM4,ATX,128 GB,4,https://www.amazon.com/dp/B089CRF5XV?tag=bgfg-pc-builder-us-20
ASRock B450M-HDV R4.0 Micro ATX AM4 Motherboard,3.8,$142.99,AM4,Micro ATX,32 GB,2,https://www.amazon.com/dp/B07MWGKHR9?tag=bgfg-pc-builder-us-20
MSI X670E GAMING PLUS WIFI ATX AM5 Motherboard,4.0,$219.99,AM5,ATX,192 GB,4,https://www.amazon.com/dp/B0CRF81BBC?tag=bgfg-pc-builder-us-20
MSI PRO B760M-P DDR4 Micro ATX LGA1700 Motherboard,,,LGA1700,Micro ATX,128 GB,4,https://www.amazon.com/s?k=MSI+PRO+B760M-P+DDR4+Micro+ATX+LGA1700+Motherboard&tag=bgfg-pc-builder-us-20
MSI MAG B550 TOMAHAWK ATX AM4 Motherboard,4.6,$169.99,AM4,ATX,128 GB,4,https://www.amazon.com/dp/B089CWDHFZ?tag=bgfg-pc-builder-us-20
ASRock B650 Steel Legend WiFi ATX AM5 Motherboard,,,AM5,ATX,192 GB,4,https://www.amazon.com/s?k=ASRock+B650+Steel+Legend+WiFi+ATX+AM5+Motherboard&tag=bgfg-pc-builder-us-20
ASRock B650M Pro RS Micro ATX AM5 Motherboard,,$139.99,AM5,Micro ATX,192 GB,4,https://www.amazon.com/s?k=ASRock+B650M+Pro+RS+Micro+ATX+AM5+Motherboard&tag=bgfg-pc-builder-us-20
Gigabyte A520M DS3H V2 Micro ATX AM4 Motherboard,,,AM4,Micro ATX,128 GB,4,https://www.amazon.com/s?k=Gigabyte+A520M+DS3H+V2+Micro+ATX+AM4+Motherboard&tag=bgfg-pc-builder-us-20
Asus ROG STRIX X870-I GAMING WIFI Mini ITX AM5 Motherboard,4.0,$449.99,AM5,Mini ITX,96 GB,2,https://www.amazon.com/dp/B0DDZWJ1KX?tag=bgfg-pc-builder-us-20
Asus ROG ZENITH II EXTREME ALPHA EATX sTRX4 Motherboard,4.5,$2169.00,sTRX4,EATX,256 GB,8,https://www.amazon.com/dp/B083ZC9L91?tag=bgfg-pc-builder-us-20
Asus ROG STRIX B760-I GAMING WIFI Mini ITX LGA1700 Motherboard,5.0,$219.99,LGA1700,Mini ITX,64 GB,2,https://www.amazon.com/dp/B0BR8TVLPL?tag=bgfg-pc-builder-us-20
Asus PRIME B650-PLUS ATX AM5 Motherboard,,$199.99,AM5,ATX,128 GB,4,https://www.amazon.com/dp/B0BHMVMMJC?tag=bgfg-pc-builder-us-20
Asus ROG STRIX X670E-E GAMING WIFI ATX AM5 Motherboard,,$591.09,AM5,ATX,128 GB,4,https://www.amazon.com/dp/B0BDTHQTJV?tag=bgfg-pc-builder-us-20
Gigabyte A520I AC Mini ITX AM4 Motherboard,5.0,$169.99,AM4,Mini ITX,64 GB,2,https://www.amazon.com/dp/B08F7BHDLY?tag=bgfg-pc-builder-us-20
Asus TUF GAMING Z790-PLUS WIFI ATX LGA1700 Motherboard,5.0,$305.08,LGA1700,ATX,128 GB,4,https://www.amazon.com/dp/B0BQD58D96?tag=bgfg-pc-builder-us-20
Asus ROG STRIX B550-A GAMING ATX AM4 Motherboard,4.7,$171.17,AM4,ATX,128 GB,4,https://www.amazon.com/dp/B08F9VP2RC?tag=bgfg-pc-builder-us-20
Asus TUF GAMING A520M-PLUS WIFI Micro ATX AM4 Motherboard,,$119.30,AM4,Micro ATX,128 GB,4,https://www.amazon.com/dp/B0997N7P12?tag=bgfg-pc-builder-us-20
Gigabyte X870 GAMING WIFI6 ATX AM5 Motherboard,,$199.99,AM5,ATX,256 GB,4,https://www.amazon.com/dp/B0DHWLN5XT?tag=bgfg-pc-builder-us-20
MSI MAG Z790 TOMAHAWK WIFI ATX LGA1700 Motherboard,5.0,$595.50,LGA1700,ATX,128 GB,4,https://www.amazon.com/dp/B09Y1FJBHX?tag=bgfg-pc-builder-us-20
ASRock A520M-ITX/ac Mini ITX AM4 Motherboard,3.5,$124.96,AM4,Mini ITX,64 GB,2,https://www.amazon.com/dp/B08G1WLVR2?tag=bgfg-pc-builder-us-20
ASRock B650M-HDV/M.2 Micro ATX AM5 Motherboard,4.7,$124.99,AM5,Micro ATX,96 GB,2,https://www.amazon.com/dp/B0BY6YRT41?tag=bgfg-pc-builder-us-20
NZXT N7 B650E ATX AM5 Motherboard,,,AM5,ATX,128 GB,4,https://www.amazon.com/s?k=NZXT+N7+B650E+ATX+AM5+Motherboard&tag=bgfg-pc-builder-us-20
Gigabyte B550 AORUS ELITE AX V2 ATX AM4 Motherboard,4.6,$214.99,AM4,ATX,128 GB,4,https://www.amazon.com/dp/B08KGVH7YC?tag=bgfg-pc-builder-us-20
ASRock B550M Pro4 Micro ATX AM4 Motherboard,4.7,$142.89,AM4,Micro ATX,128 GB,4,https://www.amazon.com/dp/B089VY5WVM?tag=bgfg-pc-builder-us-20
Asus PRIME B650M-A AX II Micro ATX AM5 Motherboard,,,AM5,Micro ATX,128 GB,4,https://www.amazon.com/s?k=Asus+PRIME+B650M-A+AX+II+Micro+ATX+AM5+Motherboard&tag=bgfg-pc-builder-us-20
Gigabyte B650 AORUS ELITE AX V2 ATX AM5 Motherboard,,$199.99,AM5,ATX,192 GB,4,https://www.amazon.com/dp/B0CMK1W2YX?tag=bgfg-pc-builder-us-20
ASRock X870E Taichi EATX AM5 Motherboard,5.0,,AM5,EATX,256 GB,4,https://www.amazon.com/s?k=ASRock+X870E+Taichi+EATX+AM5+Motherboard&tag=bgfg-pc-builder-us-20
MSI B650M GAMING PLUS WIFI Micro ATX AM5 Motherboard,,,AM5,Micro ATX,192 GB,4,https://www.amazon.com/s?k=MSI+B650M+GAMING+PLUS+WIFI+Micro+ATX+AM5+Motherboard&tag=bgfg-pc-builder-us-20
Asus ProArt X870E-CREATOR WIFI ATX AM5 Motherboard,,$479.99,AM5,ATX,192 GB,4,https://www.amazon.com/dp/B0DF123GCV?tag=bgfg-pc-builder-us-20
Asus PRIME B550M-A AC Micro ATX AM4 Motherboard,,$147.19,AM4,Micro ATX,128 GB,4,https://www.amazon.com/dp/B07VHJ34W7?tag=bgfg-pc-builder-us-20
Gigabyte B650I AORUS ULTRA Mini ITX AM5 Motherboard,,$269.99,AM5,Mini ITX,64 GB,2,https://www.amazon.com/s?k=Gigabyte+B650I+AORUS+ULTRA+Mini+ITX+AM5+Motherboard&tag=bgfg-pc-builder-us-20
MSI B450 TOMAHAWK MAX ATX AM4 Motherboard,4.6,$114.99,AM4,ATX,64 GB,4,https://www.amazon.com/dp/B07WF6ZQST?tag=bgfg-pc-builder-us-20
Asus X99-DELUXE II ATX LGA2011-3 Motherboard,4.3,,LGA2011-3,ATX,128 GB,8,https://www.amazon.com/s?k=Asus+X99-DELUXE+II+ATX+LGA2011-3+Motherboard&tag=bgfg-pc-builder-us-20
MSI MPG B650I EDGE WIFI Mini ITX AM5 Motherboard,,$239.99,AM5,Mini ITX,64 GB,2,https://www.amazon.com/s?k=MSI+MPG+B650I+EDGE+WIFI+Mini+ITX+AM5+Motherboard&tag=bgfg-pc-builder-us-20
ASRock B650M-H/M.2+ Micro ATX AM5 Motherboard,,,AM5,Micro ATX,96 GB,2,https://www.amazon.com/s?k=ASRock+B650M-H%2FM.2%2B+Micro+ATX+AM5+Motherboard&tag=bgfg-pc-builder-us-20
Asus TUF GAMING X570-PLUS (WI-FI) ATX AM4 Motherboard,4.7,$202.96,AM4,ATX,128 GB,4,https://www.amazon.com/dp/B07SXF8GY3?tag=bgfg-pc-builder-us-20
MSI MAG B660M BAZOOKA DDR4 Micro ATX LGA1700 Motherboard,,$129.99,LGA1700,Micro ATX,128 GB,4,https://www.amazon.com/dp/B09NTPPSBP?tag=bgfg-pc-builder-us-20
MSI MAG Z690 TORPEDO ATX LGA1700 Motherboard,,$365.99,LGA1700,ATX,128 GB,4,https://www.amazon.com/dp/B09HK9Q3KD?tag=bgfg-pc-builder-us-20
MSI MEG Z490 UNIFY ATX LGA1200 Motherboard,5.0,,LGA1200,ATX,128 GB,4,https://www.amazon.com/s?k=MSI+MEG+Z490+UNIFY+ATX+LGA1200+Motherboard&tag=bgfg-pc-builder-us-20
NZXT N7 Z390 ATX LGA1151 Motherboard,5.0,,LGA1151,ATX,64 GB,4,https://www.amazon.com/s?k=NZXT+N7+Z390+ATX+LGA1151+Motherboard&tag=bgfg-pc-builder-us-20
MSI Z270 GAMING M5 ATX LGA1151 Motherboard,4.6,,LGA1151,ATX,64 GB,4,https://www.amazon.com/s?k=MSI+Z270+GAMING+M5+ATX+LGA1151+Motherboard&tag=bgfg-pc-builder-us-20
Asus ROG STRIX B660-A GAMING WIFI ATX LGA1700 Motherboard,,,LGA1700,ATX,128 GB,4,https://www.amazon.com/s?k=Asus+ROG+STRIX+B660-A+GAMING+WIFI+ATX+LGA1700+Motherboard&tag=bgfg-pc-builder-us-20
Asus ROG MAXIMUS Z790 APEX ATX LGA1700 Motherboard,,$699.99,LGA1700,ATX,64 GB,2,https://www.amazon.com/s?k=Asus+ROG+MAXIMUS+Z790+APEX+ATX+LGA1700+Motherboard&tag=bgfg-pc-builder-us-20
Gigabyte GA-Z170X-Gaming 5 ATX LGA1151 Motherboard,4.8,,LGA1151,ATX,64 GB,4,https://www.amazon.com/s?k=Gigabyte+GA-Z170X-Gaming+5+ATX+LGA1151+Motherboard&tag=bgfg-pc-builder-us-20
Asus TUF B360-Plus Gaming ATX LGA1151 Motherboard,,,LGA1151,ATX,64 GB,4,https://www.amazon.com/s?k=Asus+TUF+B360-Plus+Gaming+ATX+LGA1151+Motherboard&tag=bgfg-pc-builder-us-20
Asus TUF Z390-PRO GAMING ATX LGA1151 Motherboard,5.0,,LGA1151,ATX,128 GB,4,https://www.amazon.com/s?k=Asus+TUF+Z390-PRO+GAMING+ATX+LGA1151+Motherboard&tag=bgfg-pc-builder-us-20
MSI MAG B560 TORPEDO ATX LGA1200 Motherboard,4.5,$169.99,LGA1200,ATX,128 GB,4,https://www.amazon.com/dp/B08WCMNJ6J?tag=bgfg-pc-builder-us-20
ASRock Z890 Pro RS WiFi ATX LGA1851 Motherboard,,$216.00,LGA1851,ATX,256 GB,4,https://www.amazon.com/dp/B0DJQ31RNB?tag=bgfg-pc-builder-us-20
Gigabyte GA-AX370-Gaming K5 ATX AM4 Motherboard,4.4,,AM4,ATX,64 GB,4,https://www.amazon.com/s?k=Gigabyte+GA-AX370-Gaming+K5+ATX+AM4+Motherboard&tag=bgfg-pc-builder-us-20
Gigabyte Z590 GAMING X ATX LGA1200 Motherboard,,,LGA1200,ATX,128 GB,4,https://www.amazon.com/s?k=Gigabyte+Z590+GAMING+X+ATX+LGA1200+Motherboard&tag=bgfg-pc-builder-us-20
Asus MAXIMUS VIII RANGER ATX LGA1151 Motherboard,4.8,,LGA1151,ATX,64 GB,4,https://www.amazon.com/s?k=Asus+MAXIMUS+VIII+RANGER+ATX+LGA1151+Motherboard&tag=bgfg-pc-builder-us-20
MSI Z370 PC PRO ATX LGA1151 Motherboard,4.0,,LGA1151,ATX,64 GB,4,https://www.amazon.com/s?k=MSI+Z370+PC+PRO+ATX+LGA1151+Motherboard&tag=bgfg-pc-builder-us-20
ASRock Z390M-ITX/ac Mini ITX LGA1151 Motherboard,5.0,,LGA1151,Mini ITX,64 GB,2,https://www.amazon.com/s?k=ASRock+Z390M-ITX%2Fac+Mini+ITX+LGA1151+Motherboard&tag=bgfg-pc-builder-us-20
ASRock Z590M Pro4 Micro ATX LGA1200 Motherboard,5.0,$153.38,LGA1200,Micro ATX,128 GB,4,https://www.amazon.com/dp/B08X15BQC5?tag=bgfg-pc-builder-us-20
ASRock Z890 Riptide WiFi ATX LGA1851 Motherboard,,$295.27,LGA1851,ATX,256 GB,4,https://www.amazon.com/dp/B0DJPY6CZX?tag=bgfg-pc-builder-us-20
Gigabyte Z370 AORUS GAMING WIFI (rev. 1.0) ATX LGA1151 Motherboard,4.8,,LGA1151,ATX,64 GB,4,https://www.amazon.com/s?k=Gigabyte+Z370+AORUS+GAMING+WIFI+%28rev.+1.0%29+ATX+LGA1151+Motherboard&tag=bgfg-pc-builder-us-20
MSI Z270 GAMING PLUS ATX LGA1151 Motherboard,4.4,,LGA1151,ATX,64 GB,4,https://www.amazon.com/s?k=MSI+Z270+GAMING+PLUS+ATX+LGA1151+Motherboard&tag=bgfg-pc-builder-us-20
ASRock Z790-C ATX LGA1700 Motherboard,,,LGA1700,ATX,128 GB,4,https://www.amazon.com/s?k=ASRock+Z790-C+ATX+LGA1700+Motherboard&tag=bgfg-pc-builder-us-20
MSI B860M GAMING PLUS WIFI Micro ATX LGA1851 Motherboard,,,LGA1851,Micro ATX,256 GB,4,https://www.amazon.com/s?k=MSI+B860M+GAMING+PLUS+WIFI+Micro+ATX+LGA1851+Motherboard&tag=bgfg-pc-builder-us-20
Biostar B650MT Micro ATX AM5 Motherboard,,,AM5,Micro ATX,96 GB,2,https://www.amazon.com/s?k=Biostar+B650MT+Micro+ATX+AM5+Motherboard&tag=bgfg-pc-builder-us-20
Biostar B450MX-S Micro ATX AM4 Motherboard,,,AM4,Micro ATX,128 GB,4,https://www.amazon.com/s?k=Biostar+B450MX-S+Micro+ATX+AM4+Motherboard&tag=bgfg-pc-builder-us-20
ASRock X99 Extreme4 ATX LGA2011-3 Motherboard,4.5,,LGA2011-3,ATX,128 GB,8,https://www.amazon.com/s?k=ASRock+X99+Extreme4+ATX+LGA2011-3+Motherboard&tag=bgfg-pc-builder-us-20
Gigabyte GA-X99-Designare EX ATX LGA2011-3 Motherboard,4.8,,LGA2011-3,ATX,128 GB,8,https://www.amazon.com/s?k=Gigabyte+GA-X99-Designare+EX+ATX+LGA2011-3+Motherboard&tag=bgfg-pc-builder-us-20
Asus PRIME B250M-C-CSM Micro ATX LGA1151 Motherboard,,,LGA1151,Micro ATX,64 GB,4,https://www.amazon.com/s?k=Asus+PRIME+B250M-C-CSM+Micro+ATX+LGA1151+Motherboard&tag=bgfg-pc-builder-us-20
Asus STRIX X299-E GAMING ATX LGA2066 Motherboard,4.3,,LGA2066,ATX,128 GB,8,https://www.amazon.com/s?k=Asus+STRIX+X299-E+GAMING+ATX+LGA2066+Motherboard&tag=bgfg-pc-builder-us-20
Asus ROG ZENITH EXTREME EATX sTR4 Motherboard,4.5,,sTR4,EATX,128 GB,8,https://www.amazon.com/s?k=Asus+ROG+ZENITH+EXTREME+EATX+sTR4+Motherboard&tag=bgfg-pc-builder-us-20
ASRock Z690 Phantom Gaming 4 ATX LGA1700 Motherboard,,$197.67,LGA1700,ATX,128 GB,4,https://www.amazon.com/dp/B09JM75LV6?tag=bgfg-pc-builder-us-20
Gigabyte Z690 AERO G ATX LGA1700 Motherboard,5.0,$219.00,LGA1700,ATX,128 GB,4,https://www.amazon.com/dp/B083NN4MLZ?tag=bgfg-pc-builder-us-20
ASRock Z890 Lightning WiFi ATX LGA1851 Motherboard,,$269.99,LGA1851,ATX,256 GB,4,https://www.amazon.com/dp/B0DJHNV6BR?tag=bgfg-pc-builder-us-20
Gigabyte Z890 AI TOP EATX LGA1851 Motherboard,,,LGA1851,EATX,256 GB,4,https://www.amazon.com/s?k=Gigabyte+Z890+AI+TOP+EATX+LGA1851+Motherboard&tag=bgfg-pc-builder-us-20
MSI PRO H610M-B DDR4 Micro ATX LGA1700 Motherboard,,$105.05,LGA1700,Micro ATX,64 GB,2,https://www.amazon.com/dp/B09PXPX3NX?tag=bgfg-pc-builder-us-20
ASRock X570 Taichi Razer Edition ATX AM4 Motherboard,5.0,$430.27,AM4,ATX,128 GB,4,https://www.amazon.com/s?k=ASRock+X570+Taichi+Razer+Edition+ATX+AM4+Motherboard&tag=bgfg-pc-builder-us-20
Gigabyte GA-G31M-ES2L Micro ATX LGA775 Motherboard,,,LGA775,Micro ATX,4 GB,2,https://www.amazon.com/s?k=Gigabyte+GA-G31M-ES2L+Micro+ATX+LGA775+Motherboard&tag=bgfg-pc-builder-us-20
ASRock 970A-G/3.1 ATX AM3+/AM3 Motherboard,4.3,,AM3+/AM3,ATX,64 GB,4,https://www.amazon.com/s?k=ASRock+970A-G%2F3.1+ATX+AM3%2B%2FAM3+Motherboard&tag=bgfg-pc-builder-us-20
Gigabyte GA-Z270X-Ultra Gaming ATX LGA1151 Motherboard,4.5,,LGA1151,ATX,64 GB,4,https://www.amazon.com/s?k=Gigabyte+GA-Z270X-Ultra+Gaming+ATX+LGA1151+Motherboard&tag=bgfg-pc-builder-us-20
MSI H110M PRO-VH PLUS Micro ATX LGA1151 Motherboard,,,LGA1151,Micro ATX,32 GB,2,https://www.amazon.com/s?k=MSI+H110M+PRO-VH+PLUS+Micro+ATX+LGA1151+Motherboard&tag=bgfg-pc-builder-us-20
ASRock Fatal1ty AB350 Gaming K4 ATX AM4 Motherboard,4.5,,AM4,ATX,64 GB,4,https://www.amazon.com/s?k=ASRock+Fatal1ty+AB350+Gaming+K4+ATX+AM4+Motherboard&tag=bgfg-pc-builder-us-20
MSI B360 GAMING ARCTIC ATX LGA1151 Motherboard,4.8,,LGA1151,ATX,64 GB,4,https://www.amazon.com/s?k=MSI+B360+GAMING+ARCTIC+ATX+LGA1151+Motherboard&tag=bgfg-pc-builder-us-20
ASRock X370 GAMING X ATX AM4 Motherboard,4.4,,AM4,ATX,64 GB,4,https://www.amazon.com/s?k=ASRock+X370+GAMING+X+ATX+AM4+Motherboard&tag=bgfg-pc-builder-us-20
MSI MAG B860 TOMAHAWK WIFI ATX LGA1851 Motherboard,,$229.99,LGA1851,ATX,256 GB,4,https://www.amazon.com/dp/B0DQBJ64KH?tag=bgfg-pc-builder-us-20
ASRock Z590 Pro4 ATX LGA1200 Motherboard,4.5,$99.00,LGA1200,ATX,128 GB,4,https://www.amazon.com/dp/B08X1X4QFX?tag=bgfg-pc-builder-us-20
Gigabyte GA-990FXA-UD3 ATX AM3+ Motherboard,4.6,,AM3+,ATX,32 GB,4,https://www.amazon.com/s?k=Gigabyte+GA-990FXA-UD3+ATX+AM3%2B+Motherboard&tag=bgfg-pc-builder-us-20
Gigabyte GA-Z170-HD3P ATX LGA1151 Motherboard,4.1,,LGA1151,ATX,64 GB,4,https://www.amazon.com/s?k=Gigabyte+GA-Z170-HD3P+ATX+LGA1151+Motherboard&tag=bgfg-pc-builder-us-20
ASRock Z370M Pro4 Micro ATX LGA1151 Motherboard,4.2,,LGA1151,Micro ATX,64 GB,4,https://www.amazon.com/s?k=ASRock+Z370M+Pro4+Micro+ATX+LGA1151+Motherboard&tag=bgfg-pc-builder-us-20
MSI B360-A PRO ATX LGA1151 Motherboard,4.3,,LGA1151,ATX,64 GB,4,https://www.amazon.com/s?k=MSI+B360-A+PRO+ATX+LGA1151+Motherboard&tag=bgfg-pc-builder-us-20
Asus ROG STRIX B360-I GAMING Mini ITX LGA1151 Motherboard,5.0,,LGA1151,Mini ITX,32 GB,2,https://www.amazon.com/s?k=Asus+ROG+STRIX+B360-I+GAMING+Mini+ITX+LGA1151+Motherboard&tag=bgfg-pc-builder-us-20
Gigabyte H410M S2H Micro ATX LGA1200 Motherboard,4.3,,LGA1200,Micro ATX,64 GB,2,https://www.amazon.com/s?k=Gigabyte+H410M+S2H+Micro+ATX+LGA1200+Motherboard&tag=bgfg-pc-builder-us-20
Asus ROG STRIX B560-F GAMING WIFI ATX LGA1200 Motherboard,5.0,,LGA1200,ATX,128 GB,4,https://www.amazon.com/s?k=Asus+ROG+STRIX+B560-F+GAMING+WIFI+ATX+LGA1200+Motherboard&tag=bgfg-pc-builder-us-20
Gigabyte B860M DS3H WIFI6E Micro ATX LGA1851 Motherboard,,,LGA1851,Micro ATX,256 GB,4,https://www.amazon.com/s?k=Gigabyte+B860M+DS3H+WIFI6E+Micro+ATX+LGA1851+Motherboard&tag=bgfg-pc-builder-us-20
Supermicro X10SL7-F Micro ATX LGA1150 Motherboard,,$489.48,LGA1150,Micro ATX,32 GB,4,https://www.amazon.com/dp/B00D65EHQY?tag=bgfg-pc-builder-us-20
Asus WS Z390 PRO ATX LGA1151 Motherboard,4.0,$399.00,LGA1151,ATX,128 GB,4,https://www.amazon.com/s?k=Asus+WS+Z390+PRO+ATX+LGA1151+Motherboard&tag=bgfg-pc-builder-us-20
Gigabyte GA-B250M-D3H Micro ATX LGA1151 Motherboard,4.0,,LGA1151,Micro ATX,64 GB,4,https://www.amazon.com/s?k=Gigabyte+GA-B250M-D3H+Micro+ATX+LGA1151+Motherboard&tag=bgfg-pc-builder-us-20
Asus CROSSHAIR VI HERO (WI-FI AC) ATX AM4 Motherboard,4.4,,AM4,ATX,64 GB,4,https://www.amazon.com/s?k=Asus+CROSSHAIR+VI+HERO+%28WI-FI+AC%29+ATX+AM4+Motherboard&tag=bgfg-pc-builder-us-20
MSI X470 GAMING PRO MAX ATX AM4 Motherboard,,,AM4,ATX,128 GB,4,https://www.amazon.com/s?k=MSI+X470+GAMING+PRO+MAX+ATX+AM4+Motherboard&tag=bgfg-pc-builder-us-20
Gigabyte B660 AORUS Master DDR4 ATX LGA1700 Motherboard,5.0,$164.99,LGA1700,ATX,128 GB,4,https://www.amazon.com/dp/B09QNVD2SW?tag=bgfg-pc-builder-us-20
Gigabyte GA-H81M-DS2 Micro ATX LGA1150 Motherboard,4.5,,LGA1150,Micro ATX,16 GB,2,https://www.amazon.com/s?k=Gigabyte+GA-H81M-DS2+Micro+ATX+LGA1150+Motherboard&tag=bgfg-pc-builder-us-20
Gigabyte GA-X99M-GAMING 5 Micro ATX LGA2011-3 Motherboard,5.0,,LGA2011-3,Micro ATX,32 GB,4,https://www.amazon.com/s?k=Gigabyte+GA-X99M-GAMING+5+Micro+ATX+LGA2011-3+Motherboard&tag=bgfg-pc-builder-us-20
ASRock B360M-HDV Micro ATX LGA1151 Motherboard,4.0,,LGA1151,Micro ATX,32 GB,2,https://www.amazon.com/s?k=ASRock+B360M-HDV+Micro+ATX+LGA1151+Motherboard&tag=bgfg-pc-builder-us-20
