name,rating,price,socket/cpu,form factor,memory max,memory slots,link
Gigabyte Z690 UD DDR4 ATX LGA1700 Motherboard,4.7,$194.99,LGA1700,ATX,128 GB,4,https://www.amazon.com/dp/B09KC5W9FY?tag=bgfg-pc-builder-us-20
ASRock X570D4U-2L2T Micro ATX AM4 Motherboard,,,AM4,Micro ATX,128 GB,4,https://www.amazon.com/s?k=ASRock+X570D4U-2L2T+Micro+ATX+AM4+Motherboard&tag=bgfg-pc-builder-us-20
ASRock H610M-HDV/M.2 Micro ATX LGA1700 Motherboard,,,LGA1700,Micro ATX,64 GB,2,https://www.amazon.com/s?k=ASRock+H610M-HDV%2FM.2+Micro+ATX+LGA1700+Motherboard&tag=bgfg-pc-builder-us-20
Gigabyte Z490 AORUS ELITE AC ATX LGA1200 Motherboard,4.8,$84.99,LGA1200,ATX,128 GB,4,https://www.amazon.com/dp/B087GFYBCW?tag=bgfg-pc-builder-us-20
Asus PRIME H610M-A Micro ATX LGA1700 Motherboard,,,LGA1700,Micro ATX,96 GB,2,https://www.amazon.com/s?k=Asus+PRIME+H610M-A+Micro+ATX+LGA1700+Motherboard&tag=bgfg-pc-builder-us-20
ASRock X299E-ITX/ac Mini ITX LGA2066 Motherboard,3.7,,LGA2066,Mini ITX,128 GB,4,https://www.amazon.com/s?k=ASRock+X299E-ITX%2Fac+Mini+ITX+LGA2066+Motherboard&tag=bgfg-pc-builder-us-20
Asus H110-PLUS ATX LGA1151 Motherboard,4.0,,LGA1151,ATX,32 GB,2,https://www.amazon.com/s?k=Asus+H110-PLUS+ATX+LGA1151+Motherboard&tag=bgfg-pc-builder-us-20
Gigabyte Z390 D ATX LGA1151 Motherboard,,,LGA1151,ATX,128 GB,4,https://www.amazon.com/s?k=Gigabyte+Z390+D+ATX+LGA1151+Motherboard&tag=bgfg-pc-builder-us-20
MSI A320M PRO-VH Micro ATX AM4 Motherboard,,,AM4,Micro ATX,64 GB,2,https://www.amazon.com/s?k=MSI+A320M+PRO-VH+Micro+ATX+AM4+Motherboard&tag=bgfg-pc-builder-us-20
Gigabyte H410M S2 V3 Micro ATX LGA1200 Motherboard,,,LGA1200,Micro ATX,64 GB,2,https://www.amazon.com/s?k=Gigabyte+H410M+S2+V3+Micro+ATX+LGA1200+Motherboard&tag=bgfg-pc-builder-us-20
Gigabyte B560M AORUS PRO AX Micro ATX LGA1200 Motherboard,4.0,$104.00,LGA1200,Micro ATX,128 GB,4,https://www.amazon.com/dp/B083HZHL6Y?tag=bgfg-pc-builder-us-20
Asus TUF GAMING Z690-PLUS D4 ATX LGA1700 Motherboard,5.0,$321.99,LGA1700,ATX,128 GB,4,https://www.amazon.com/dp/B09JVZ8L5G?tag=bgfg-pc-builder-us-20
Asus Z10PE-D8 WS SSI EEB Dual-CPU LGA2011-3 Motherboard,,,2 x LGA2011-3,SSI EEB,512 GB,8,https://www.amazon.com/s?k=Asus+Z10PE-D8+WS+SSI+EEB+Dual-CPU+LGA2011-3+Motherboard&tag=bgfg-pc-builder-us-20
MSI B360M MORTAR Micro ATX LGA1151 Motherboard,4.0,,LGA1151,Micro ATX,64 GB,4,https://www.amazon.com/s?k=MSI+B360M+MORTAR+Micro+ATX+LGA1151+Motherboard&tag=bgfg-pc-builder-us-20
Gigabyte X470 AORUS GAMING 5 WIFI ATX AM4 Motherboard,4.4,,AM4,ATX,64 GB,4,https://www.amazon.com/s?k=Gigabyte+X470+AORUS+GAMING+5+WIFI+ATX+AM4+Motherboard&tag=bgfg-pc-builder-us-20
Gigabyte GA-H97M-D3H Micro ATX LGA1150 Motherboard,4.9,,LGA1150,Micro ATX,32 GB,4,https://www.amazon.com/s?k=Gigabyte+GA-H97M-D3H+Micro+ATX+LGA1150+Motherboard&tag=bgfg-pc-builder-us-20
MSI B350M MORTAR Micro ATX AM4 Motherboard,4.2,,AM4,Micro ATX,64 GB,4,https://www.amazon.com/s?k=MSI+B350M+MORTAR+Micro+ATX+AM4+Motherboard&tag=bgfg-pc-builder-us-20
ASRock Z590M Phantom Gaming 4 Micro ATX LGA1200 Motherboard,3.0,$161.00,LGA1200,Micro ATX,128 GB,4,https://www.amazon.com/dp/B08XNL6GV4?tag=bgfg-pc-builder-us-20
ASRock B760M PG Lightning/D4 Micro ATX LGA1700 Motherboard,,$111.98,LGA1700,Micro ATX,128 GB,4,https://www.amazon.com/s?k=ASRock+B760M+PG+Lightning%2FD4+Micro+ATX+LGA1700+Motherboard&tag=bgfg-pc-builder-us-20
Asus H81M-C/CSM Micro ATX LGA1150 Motherboard,3.5,,LGA1150,Micro ATX,16 GB,2,https://www.amazon.com/s?k=Asus+H81M-C%2FCSM+Micro+ATX+LGA1150+Motherboard&tag=bgfg-pc-builder-us-20
ASRock B650M PG Riptide WiFi White Micro ATX AM5 Motherboard,,,AM5,Micro ATX,192 GB,4,https://www.amazon.com/s?k=ASRock+B650M+PG+Riptide+WiFi+White+Micro+ATX+AM5+Motherboard&tag=bgfg-pc-builder-us-20
ASRock Z890 Taichi OCF ATX LGA1851 Motherboard,,$564.66,LGA1851,ATX,128 GB,2,https://www.amazon.com/dp/B0DJRPLRJB?tag=bgfg-pc-builder-us-20
ASRock AB350 Gaming-ITX/ac Mini ITX AM4 Motherboard,4.5,,AM4,Mini ITX,32 GB,2,https://www.amazon.com/s?k=ASRock+AB350+Gaming-ITX%2Fac+Mini+ITX+AM4+Motherboard&tag=bgfg-pc-builder-us-20
Asus TUF Z270 MARK 2 ATX LGA1151 Motherboard,4.8,,LGA1151,ATX,64 GB,4,https://www.amazon.com/s?k=Asus+TUF+Z270+MARK+2+ATX+LGA1151+Motherboard&tag=bgfg-pc-builder-us-20
Gigabyte B760 AORUS ELITE AX DDR4 ATX LGA1700 Motherboard,,,LGA1700,ATX,128 GB,4,https://www.amazon.com/s?k=Gigabyte+B760+AORUS+ELITE+AX+DDR4+ATX+LGA1700+Motherboard&tag=bgfg-pc-builder-us-20
Asus ROG MAXIMUS VIII HERO ALPHA ATX LGA1151 Motherboard,4.7,,LGA1151,ATX,64 GB,4,https://www.amazon.com/s?k=Asus+ROG+MAXIMUS+VIII+HERO+ALPHA+ATX+LGA1151+Motherboard&tag=bgfg-pc-builder-us-20
Asus M5A99FX PRO R2.0 ATX AM3+ Motherboard,4.7,,AM3+,ATX,32 GB,4,https://www.amazon.com/s?k=Asus+M5A99FX+PRO+R2.0+ATX+AM3%2B+Motherboard&tag=bgfg-pc-builder-us-20
MSI Z170A GAMING PRO CARBON ATX LGA1151 Motherboard,4.7,,LGA1151,ATX,64 GB,4,https://www.amazon.com/s?k=MSI+Z170A+GAMING+PRO+CARBON+ATX+LGA1151+Motherboard&tag=bgfg-pc-builder-us-20
MSI X470 GAMING PRO ATX AM4 Motherboard,4.6,,AM4,ATX,64 GB,4,https://www.amazon.com/s?k=MSI+X470+GAMING+PRO+ATX+AM4+Motherboard&tag=bgfg-pc-builder-us-20
MSI B450M PRO-VDH PLUS Micro ATX AM4 Motherboard,4.3,$229.86,AM4,Micro ATX,64 GB,4,https://www.amazon.com/dp/B07NH4H5X8?tag=bgfg-pc-builder-us-20
Biostar B550MH Micro ATX AM4 Motherboard,,$122.62,AM4,Micro ATX,64 GB,2,https://www.amazon.com/dp/B08F1X9QNY?tag=bgfg-pc-builder-us-20
ASRock B660M Phantom Gaming 4 Micro ATX LGA1700 Motherboard,,$118.15,LGA1700,Micro ATX,128 GB,4,https://www.amazon.com/dp/B09TYVTCL8?tag=bgfg-pc-builder-us-20
ASRock Z890 Pro RS ATX LGA1851 Motherboard,,$219.99,LGA1851,ATX,256 GB,4,https://www.amazon.com/dp/B0DJQ38QP1?tag=bgfg-pc-builder-us-20
Gigabyte X670 GAMING X AX (rev. 1.0) ATX AM5 Motherboard,,,AM5,ATX,128 GB,4,https://www.amazon.com/s?k=Gigabyte+X670+GAMING+X+AX+%28rev.+1.0%29+ATX+AM5+Motherboard&tag=bgfg-pc-builder-us-20
MSI X299 PRO ATX LGA2066 Motherboard,,$249.99,LGA2066,ATX,256 GB,8,https://www.amazon.com/dp/B07ZJZTT5R?tag=bgfg-pc-builder-us-20
MSI Z270 SLI PLUS ATX LGA1151 Motherboard,5.0,,LGA1151,ATX,64 GB,4,https://www.amazon.com/s?k=MSI+Z270+SLI+PLUS+ATX+LGA1151+Motherboard&tag=bgfg-pc-builder-us-20
Asus Z97 PRO GAMER ATX LGA1150 Motherboard,4.6,,LGA1150,ATX,32 GB,4,https://www.amazon.com/s?k=Asus+Z97+PRO+GAMER+ATX+LGA1150+Motherboard&tag=bgfg-pc-builder-us-20
MSI B360M PRO-VDH Micro ATX LGA1151 Motherboard,3.8,,LGA1151,Micro ATX,64 GB,4,https://www.amazon.com/s?k=MSI+B360M+PRO-VDH+Micro+ATX+LGA1151+Motherboard&tag=bgfg-pc-builder-us-20
MSI B450M BAZOOKA V2 Micro ATX AM4 Motherboard,4.7,,AM4,Micro ATX,64 GB,4,https://www.amazon.com/s?k=MSI+B450M+BAZOOKA+V2+Micro+ATX+AM4+Motherboard&tag=bgfg-pc-builder-us-20
Asus TUF GAMING Z490-PLUS ATX LGA1200 Motherboard,4.8,$286.50,LGA1200,ATX,128 GB,4,https://www.amazon.com/dp/B087YP3HBT?tag=bgfg-pc-builder-us-20
Gigabyte B650M H Micro ATX AM5 Motherboard,,,AM5,Micro ATX,96 GB,2,https://www.amazon.com/s?k=Gigabyte+B650M+H+Micro+ATX+AM5+Motherboard&tag=bgfg-pc-builder-us-20
Asus Q87M-E/CSM Micro ATX LGA1150 Motherboard,4.7,,LGA1150,Micro ATX,32 GB,4,https://www.amazon.com/s?k=Asus+Q87M-E%2FCSM+Micro+ATX+LGA1150+Motherboard&tag=bgfg-pc-builder-us-20
MSI B150 Gaming M3 ATX LGA1151 Motherboard,4.8,,LGA1151,ATX,64 GB,4,https://www.amazon.com/s?k=MSI+B150+Gaming+M3+ATX+LGA1151+Motherboard&tag=bgfg-pc-builder-us-20
Asus B150M-A/M.2 Micro ATX LGA1151 Motherboard,4.3,,LGA1151,Micro ATX,64 GB,4,https://www.amazon.com/s?k=Asus+B150M-A%2FM.2+Micro+ATX+LGA1151+Motherboard&tag=bgfg-pc-builder-us-20
Gigabyte Z690M AORUS ELITE AX DDR4 Micro ATX LGA1700 Motherboard,,$361.54,LGA1700,Micro ATX,128 GB,4,https://www.amazon.com/dp/B09KVH5B7J?tag=bgfg-pc-builder-us-20
MSI Z170A KRAIT GAMING 3X ATX LGA1151 Motherboard,4.8,,LGA1151,ATX,64 GB,4,https://www.amazon.com/s?k=MSI+Z170A+KRAIT+GAMING+3X+ATX+LGA1151+Motherboard&tag=bgfg-pc-builder-us-20
Asus TUF GAMING B450M-PRO S Micro ATX AM4 Motherboard,4.3,$115.99,AM4,Micro ATX,128 GB,4,https://www.amazon.com/dp/B08CQN1K6Q?tag=bgfg-pc-builder-us-20
Gigabyte GA-H61M-DS2 Micro ATX LGA1155 Motherboard,3.5,,LGA1155,Micro ATX,16 GB,2,https://www.amazon.com/s?k=Gigabyte+GA-H61M-DS2+Micro+ATX+LGA1155+Motherboard&tag=bgfg-pc-builder-us-20
MSI Creator TRX40 EATX sTRX4 Motherboard,5.0,,sTRX4,EATX,256 GB,8,https://www.amazon.com/s?k=MSI+Creator+TRX40+EATX+sTRX4+Motherboard&tag=bgfg-pc-builder-us-20
MSI PRO B660M-A WIFI Micro ATX LGA1700 Motherboard,,$159.99,LGA1700,Micro ATX,128 GB,4,https://www.amazon.com/s?k=MSI+PRO+B660M-A+WIFI+Micro+ATX+LGA1700+Motherboard&tag=bgfg-pc-builder-us-20
ASRock Fatal1ty X399 Professional Gaming ATX sTR4 Motherboard,4.0,,sTR4,ATX,128 GB,8,https://www.amazon.com/s?k=ASRock+Fatal1ty+X399+Professional+Gaming+ATX+sTR4+Motherboard&tag=bgfg-pc-builder-us-20
ASRock G31M-S R2.0 Micro ATX LGA775 Motherboard,,,LGA775,Micro ATX,8 GB,2,https://www.amazon.com/s?k=ASRock+G31M-S+R2.0+Micro+ATX+LGA775+Motherboard&tag=bgfg-pc-builder-us-20
Gigabyte Z390 M GAMING Micro ATX LGA1151 Motherboard,4.5,,LGA1151,Micro ATX,128 GB,4,https://www.amazon.com/s?k=Gigabyte+Z390+M+GAMING+Micro+ATX+LGA1151+Motherboard&tag=bgfg-pc-builder-us-20
Asus ROG STRIX B450-E GAMING ATX AM4 Motherboard,4.6,,AM4,ATX,64 GB,4,https://www.amazon.com/s?k=Asus+ROG+STRIX+B450-E+GAMING+ATX+AM4+Motherboard&tag=bgfg-pc-builder-us-20
MSI MAG B660M MORTAR DDR4 Micro ATX LGA1700 Motherboard,5.0,$201.09,LGA1700,Micro ATX,128 GB,4,https://www.amazon.com/s?k=MSI+MAG+B660M+MORTAR+DDR4+Micro+ATX+LGA1700+Motherboard&tag=bgfg-pc-builder-us-20
Asus ROG MAXIMUS XI EXTREME EATX LGA1151 Motherboard,5.0,,LGA1151,EATX,128 GB,4,https://www.amazon.com/s?k=Asus+ROG+MAXIMUS+XI+EXTREME+EATX+LGA1151+Motherboard&tag=bgfg-pc-builder-us-20
MSI PRO B550-P GEN3 ATX AM4 Motherboard,,,AM4,ATX,128 GB,4,https://www.amazon.com/s?k=MSI+PRO+B550-P+GEN3+ATX+AM4+Motherboard&tag=bgfg-pc-builder-us-20
MSI H110M Pro-VD Micro ATX LGA1151 Motherboard,4.0,,LGA1151,Micro ATX,32 GB,2,https://www.amazon.com/s?k=MSI+H110M+Pro-VD+Micro+ATX+LGA1151+Motherboard&tag=bgfg-pc-builder-us-20
Asus STRIX B250F GAMING ATX LGA1151 Motherboard,5.0,,LGA1151,ATX,64 GB,4,https://www.amazon.com/s?k=Asus+STRIX+B250F+GAMING+ATX+LGA1151+Motherboard&tag=bgfg-pc-builder-us-20
ASRock X470 Master SLI/AC ATX AM4 Motherboard,4.7,,AM4,ATX,64 GB,4,https://www.amazon.com/s?k=ASRock+X470+Master+SLI%2FAC+ATX+AM4+Motherboard&tag=bgfg-pc-builder-us-20
Gigabyte X470 AORUS GAMING 7 WIFI ATX AM4 Motherboard,4.5,,AM4,ATX,64 GB,4,https://www.amazon.com/s?k=Gigabyte+X470+AORUS+GAMING+7+WIFI+ATX+AM4+Motherboard&tag=bgfg-pc-builder-us-20
Gigabyte GA-AB350M-DS3H V2 Micro ATX AM4 Motherboard,,,AM4,Micro ATX,64 GB,4,https://www.amazon.com/s?k=Gigabyte+GA-AB350M-DS3H+V2+Micro+ATX+AM4+Motherboard&tag=bgfg-pc-builder-us-20
Asus A620M-AYW WIFI Micro ATX AM5 Motherboard,,,AM5,Micro ATX,96 GB,2,https://www.amazon.com/s?k=Asus+A620M-AYW+WIFI+Micro+ATX+AM5+Motherboard&tag=bgfg-pc-builder-us-20
Asus PRO Q570M-C/CSM Micro ATX LGA1200 Motherboard,,$152.99,LGA1200,Micro ATX,128 GB,4,https://www.amazon.com/dp/B09322DLZS?tag=bgfg-pc-builder-us-20
Asus PRIME A320M-E Micro ATX AM4 Motherboard,,$141.68,AM4,Micro ATX,64 GB,2,https://www.amazon.com/dp/B074KZRL8Q?tag=bgfg-pc-builder-us-20
MSI MAG B460 TOMAHAWK ATX LGA1200 Motherboard,4.8,,LGA1200,ATX,128 GB,4,https://www.amazon.com/s?k=MSI+MAG+B460+TOMAHAWK+ATX+LGA1200+Motherboard&tag=bgfg-pc-builder-us-20
Gigabyte B860I AORUS PRO ICE Mini ITX LGA1851 Motherboard,,,LGA1851,Mini ITX,128 GB,2,https://www.amazon.com/s?k=Gigabyte+B860I+AORUS+PRO+ICE+Mini+ITX+LGA1851+Motherboard&tag=bgfg-pc-builder-us-20
ASRock B450M Pro4-F R2.0 Micro ATX AM4 Motherboard,,$217.63,AM4,Micro ATX,128 GB,4,https://www.amazon.com/dp/B09B5PZ7QQ?tag=bgfg-pc-builder-us-20
Asus PRIME H610M-D D4 Micro ATX LGA1700 Motherboard,,,LGA1700,Micro ATX,64 GB,2,https://www.amazon.com/s?k=Asus+PRIME+H610M-D+D4+Micro+ATX+LGA1700+Motherboard&tag=bgfg-pc-builder-us-20
Gigabyte GA-AB350N-Gaming WIFI (rev. 1.0) Mini ITX AM4 Motherboard,4.2,,AM4,Mini ITX,32 GB,2,https://www.amazon.com/s?k=Gigabyte+GA-AB350N-Gaming+WIFI+%28rev.+1.0%29+Mini+ITX+AM4+Motherboard&tag=bgfg-pc-builder-us-20
ASRock X470 Taichi Ultimate ATX AM4 Motherboard,3.3,,AM4,ATX,64 GB,4,https://www.amazon.com/s?k=ASRock+X470+Taichi+Ultimate+ATX+AM4+Motherboard&tag=bgfg-pc-builder-us-20
Asus TUF GAMING H670-PRO WIFI D4 ATX LGA1700 Motherboard,4.0,$189.99,LGA1700,ATX,128 GB,4,https://www.amazon.com/dp/B09NWFPC34?tag=bgfg-pc-builder-us-20
Gigabyte B660M GAMING X DDR4 Micro ATX LGA1700 Motherboard,,$219.99,LGA1700,Micro ATX,128 GB,4,https://www.amazon.com/dp/B09RMQ39QW?tag=bgfg-pc-builder-us-20
ASRock X570 Steel Legend WiFi ax ATX AM4 Motherboard,4.3,$169.99,AM4,ATX,128 GB,4,https://www.amazon.com/dp/B07WHHWBX5?tag=bgfg-pc-builder-us-20
Asus PRIME Z590-V ATX LGA1200 Motherboard,5.0,$145.55,LGA1200,ATX,128 GB,4,https://www.amazon.com/dp/B0916P7CP5?tag=bgfg-pc-builder-us-20
Asus PRIME H610M-K D4-ARGB Micro ATX LGA1700 Motherboard,,,LGA1700,Micro ATX,64 GB,2,https://www.amazon.com/s?k=Asus+PRIME+H610M-K+D4-ARGB+Micro+ATX+LGA1700+Motherboard&tag=bgfg-pc-builder-us-20
Asus ProArt B760-CREATOR ATX LGA1700 Motherboard,,,LGA1700,ATX,192 GB,4,https://www.amazon.com/s?k=Asus+ProArt+B760-CREATOR+ATX+LGA1700+Motherboard&tag=bgfg-pc-builder-us-20
MSI Big Bang-Marshal (B3) XL ATX LGA1155 Motherboard,,,LGA1155,XL ATX,32 GB,4,https://www.amazon.com/s?k=MSI+Big+Bang-Marshal+%28B3%29+XL+ATX+LGA1155+Motherboard&tag=bgfg-pc-builder-us-20
Asus P8Z77-V PRO ATX LGA1155 Motherboard,4.8,,LGA1155,ATX,32 GB,4,https://www.amazon.com/s?k=Asus+P8Z77-V+PRO+ATX+LGA1155+Motherboard&tag=bgfg-pc-builder-us-20
MSI PRO H610M-S DDR4 Micro ATX LGA1700 Motherboard,,,LGA1700,Micro ATX,64 GB,2,https://www.amazon.com/s?k=MSI+PRO+H610M-S+DDR4+Micro+ATX+LGA1700+Motherboard&tag=bgfg-pc-builder-us-20
Gigabyte H610M S2H DDR4 Micro ATX LGA1700 Motherboard,,$89.99,LGA1700,Micro ATX,64 GB,2,https://www.amazon.com/dp/B09S6NQPM6?tag=bgfg-pc-builder-us-20
MSI B550M PRO Micro ATX AM4 Motherboard,,$148.68,AM4,Micro ATX,64 GB,2,https://www.amazon.com/dp/B08P2CC4CJ?tag=bgfg-pc-builder-us-20
ASRock B365M Phantom Gaming 4 Micro ATX LGA1151 Motherboard,4.6,,LGA1151,Micro ATX,128 GB,4,https://www.amazon.com/s?k=ASRock+B365M+Phantom+Gaming+4+Micro+ATX+LGA1151+Motherboard&tag=bgfg-pc-builder-us-20
Gigabyte B560M DS3H Micro ATX LGA1200 Motherboard,4.8,$119.49,LGA1200,Micro ATX,128 GB,4,https://www.amazon.com/s?k=Gigabyte+B560M+DS3H+Micro+ATX+LGA1200+Motherboard&tag=bgfg-pc-builder-us-20
Gigabyte B650M AORUS ELITE Micro ATX AM5 Motherboard,,,AM5,Micro ATX,128 GB,4,https://www.amazon.com/s?k=Gigabyte+B650M+AORUS+ELITE+Micro+ATX+AM5+Motherboard&tag=bgfg-pc-builder-us-20
ASRock Fatal1ty X470 Gaming K4 ATX AM4 Motherboard,4.0,,AM4,ATX,64 GB,4,https://www.amazon.com/s?k=ASRock+Fatal1ty+X470+Gaming+K4+ATX+AM4+Motherboard&tag=bgfg-pc-builder-us-20
MSI Big Bang - XPower II XL ATX LGA2011 Motherboard,4.5,,LGA2011,XL ATX,128 GB,8,https://www.amazon.com/s?k=MSI+Big+Bang+-+XPower+II+XL+ATX+LGA2011+Motherboard&tag=bgfg-pc-builder-us-20
Asus PRIME B650-PLUS-CSM ATX AM5 Motherboard,,,AM5,ATX,128 GB,4,https://www.amazon.com/s?k=Asus+PRIME+B650-PLUS-CSM+ATX+AM5+Motherboard&tag=bgfg-pc-builder-us-20
Asus PRIME B650M-A WIFI II-CSM Micro ATX AM5 Motherboard,,,AM5,Micro ATX,128 GB,4,https://www.amazon.com/s?k=Asus+PRIME+B650M-A+WIFI+II-CSM+Micro+ATX+AM5+Motherboard&tag=bgfg-pc-builder-us-20
Gigabyte Z690 AORUS ELITE AX ATX LGA1700 Motherboard,,$199.99,LGA1700,ATX,128 GB,4,https://www.amazon.com/dp/B083NPKL1C?tag=bgfg-pc-builder-us-20
MSI B250M PRO-VD Micro ATX LGA1151 Motherboard,4.3,,LGA1151,Micro ATX,32 GB,2,https://www.amazon.com/s?k=MSI+B250M+PRO-VD+Micro+ATX+LGA1151+Motherboard&tag=bgfg-pc-builder-us-20
Asus PRIME H410M-E Micro ATX LGA1200 Motherboard,2.0,$113.19,LGA1200,Micro ATX,64 GB,2,https://www.amazon.com/dp/B087M5DFJJ?tag=bgfg-pc-builder-us-20
Asus P8H61-M LX3 R2.0 Micro ATX LGA1155 Motherboard,3.0,,LGA1155,Micro ATX,16 GB,2,https://www.amazon.com/s?k=Asus+P8H61-M+LX3+R2.0+Micro+ATX+LGA1155+Motherboard&tag=bgfg-pc-builder-us-20
Asus ROG MAXIMUS XII FORMULA ATX LGA1200 Motherboard,5.0,$322.20,LGA1200,ATX,128 GB,4,https://www.amazon.com/dp/B087LHPYT6?tag=bgfg-pc-builder-us-20
Asus PRIME X670E-PRO WIFI-CSM ATX AM5 Motherboard,,,AM5,ATX,128 GB,4,https://www.amazon.com/s?k=Asus+PRIME+X670E-PRO+WIFI-CSM+ATX+AM5+Motherboard&tag=bgfg-pc-builder-us-20
Asus H110I-PLUS Mini ITX LGA1151 Motherboard,5.0,,LGA1151,Mini ITX,32 GB,2,https://www.amazon.com/s?k=Asus+H110I-PLUS+Mini+ITX+LGA1151+Motherboard&tag=bgfg-pc-builder-us-20
Asus ROG STRIX B560-A GAMING WIFI ATX LGA1200 Motherboard,4.7,$205.00,LGA1200,ATX,128 GB,4,https://www.amazon.com/dp/B08WRB9QRR?tag=bgfg-pc-builder-us-20
MSI B650M BOMBER WIFI Micro ATX AM5 Motherboard,,,AM5,Micro ATX,128 GB,2,https://www.amazon.com/s?k=MSI+B650M+BOMBER+WIFI+Micro+ATX+AM5+Motherboard&tag=bgfg-pc-builder-us-20
Asus TUF GAMING A520M-PLUS Micro ATX AM4 Motherboard,,$154.00,AM4,Micro ATX,128 GB,4,https://www.amazon.com/dp/B08DQG9W6P?tag=bgfg-pc-builder-us-20
Asus ROG STRIX Z690-A GAMING WIFI ATX LGA1700 Motherboard,,,LGA1700,ATX,192 GB,4,https://www.amazon.com/s?k=Asus+ROG+STRIX+Z690-A+GAMING+WIFI+ATX+LGA1700+Motherboard&tag=bgfg-pc-builder-us-20
Asus PRIME H810M-A-CSM Micro ATX LGA1851 Motherboard,,,LGA1851,Micro ATX,128 GB,2,https://www.amazon.com/s?k=Asus+PRIME+H810M-A-CSM+Micro+ATX+LGA1851+Motherboard&tag=bgfg-pc-builder-us-20
ASRock Z790 Pro RS/D4 ATX LGA1700 Motherboard,,$316.14,LGA1700,ATX,128 GB,4,https://www.amazon.com/dp/B0BJDYY863?tag=bgfg-pc-builder-us-20
ASRock H310M-HDV/M.2 Micro ATX LGA1151 Motherboard,5.0,,LGA1151,Micro ATX,32 GB,2,https://www.amazon.com/s?k=ASRock+H310M-HDV%2FM.2+Micro+ATX+LGA1151+Motherboard&tag=bgfg-pc-builder-us-20
MSI PRO B660M-G DDR4 Micro ATX LGA1700 Motherboard,,$112.77,LGA1700,Micro ATX,64 GB,2,https://www.amazon.com/dp/B09NW15QWS?tag=bgfg-pc-builder-us-20
Asus ROG MAXIMUS Z790 HERO EVA-02 EDITION ATX LGA1700 Motherboard,,,LGA1700,ATX,192 GB,4,https://www.amazon.com/s?k=Asus+ROG+MAXIMUS+Z790+HERO+EVA-02+EDITION+ATX+LGA1700+Motherboard&tag=bgfg-pc-builder-us-20
MSI MPG Z590 GAMING CARBON WIFI ATX LGA1200 Motherboard,,$242.41,LGA1200,ATX,128 GB,4,https://www.amazon.com/dp/B08WBW8DB7?tag=bgfg-pc-builder-us-20
ASRock B760 Pro RS/D4 WiFi White ATX LGA1700 Motherboard,,,LGA1700,ATX,128 GB,4,https://www.amazon.com/s?k=ASRock+B760+Pro+RS%2FD4+WiFi+White+ATX+LGA1700+Motherboard&tag=bgfg-pc-builder-us-20
MSI MPG Z390I GAMING EDGE AC Mini ITX LGA1151 Motherboard,4.4,,LGA1151,Mini ITX,64 GB,2,https://www.amazon.com/s?k=MSI+MPG+Z390I+GAMING+EDGE+AC+Mini+ITX+LGA1151+Motherboard&tag=bgfg-pc-builder-us-20
Asus Z97I-PLUS Mini ITX LGA1150 Motherboard,4.8,,LGA1150,Mini ITX,16 GB,2,https://www.amazon.com/s?k=Asus+Z97I-PLUS+Mini+ITX+LGA1150+Motherboard&tag=bgfg-pc-builder-us-20
ASRock B365 Pro4 ATX LGA1151 Motherboard,4.3,,LGA1151,ATX,64 GB,4,https://www.amazon.com/s?k=ASRock+B365+Pro4+ATX+LGA1151+Motherboard&tag=bgfg-pc-builder-us-20
ASRock B365M-HDV Micro ATX LGA1151 Motherboard,4.0,$69.99,LGA1151,Micro ATX,32 GB,2,https://www.amazon.com/dp/B07RTXH3PG?tag=bgfg-pc-builder-us-20
ASRock X570 PG Velocita ATX AM4 Motherboard,5.0,$224.99,AM4,ATX,128 GB,4,https://www.amazon.com/s?k=ASRock+X570+PG+Velocita+ATX+AM4+Motherboard&tag=bgfg-pc-builder-us-20
Asus PRIME Z370-P II ATX LGA1151 Motherboard,,,LGA1151,ATX,64 GB,4,https://www.amazon.com/s?k=Asus+PRIME+Z370-P+II+ATX+LGA1151+Motherboard&tag=bgfg-pc-builder-us-20
ASRock H670M-ITX/ax Mini ITX LGA1700 Motherboard,4.3,$169.99,LGA1700,Mini ITX,128 GB,2,https://www.amazon.com/s?k=ASRock+H670M-ITX%2Fax+Mini+ITX+LGA1700+Motherboard&tag=bgfg-pc-builder-us-20
Gigabyte GA-AB350-Gaming ATX AM4 Motherboard,4.2,,AM4,ATX,64 GB,4,https://www.amazon.com/s?k=Gigabyte+GA-AB350-Gaming+ATX+AM4+Motherboard&tag=bgfg-pc-builder-us-20
Gigabyte Z790 AORUS XTREME X EATX LGA1700 Motherboard,,$949.99,LGA1700,EATX,192 GB,4,https://www.amazon.com/dp/B083RVPG5L?tag=bgfg-pc-builder-us-20
Asus H110M-C/CSM Micro ATX LGA1151 Motherboard,4.0,,LGA1151,Micro ATX,32 GB,2,https://www.amazon.com/s?k=Asus+H110M-C%2FCSM+Micro+ATX+LGA1151+Motherboard&tag=bgfg-pc-builder-us-20
Asus Q170M-C/CSM Micro ATX LGA1151 Motherboard,3.0,,LGA1151,Micro ATX,64 GB,4,https://www.amazon.com/s?k=Asus+Q170M-C%2FCSM+Micro+ATX+LGA1151+Motherboard&tag=bgfg-pc-builder-us-20
MSI MEG Z690 UNIFY-X ATX LGA1700 Motherboard,,$459.99,LGA1700,ATX,64 GB,2,https://www.amazon.com/s?k=MSI+MEG+Z690+UNIFY-X+ATX+LGA1700+Motherboard&tag=bgfg-pc-builder-us-20
Asus Prime A320I-K Mini ITX AM4 Motherboard,4.8,$135.34,AM4,Mini ITX,32 GB,2,https://www.amazon.com/dp/B07VHQYGPP?tag=bgfg-pc-builder-us-20
ASRock AB350M Micro ATX AM4 Motherboard,4.4,,AM4,Micro ATX,32 GB,2,https://www.amazon.com/s?k=ASRock+AB350M+Micro+ATX+AM4+Motherboard&tag=bgfg-pc-builder-us-20
Asus PRIME Z690-P ATX LGA1700 Motherboard,5.0,$199.99,LGA1700,ATX,128 GB,4,https://www.amazon.com/dp/B09J1RGBRK?tag=bgfg-pc-builder-us-20
Gigabyte A520M DS3H AC Micro ATX AM4 Motherboard,,,AM4,Micro ATX,128 GB,4,https://www.amazon.com/s?k=Gigabyte+A520M+DS3H+AC+Micro+ATX+AM4+Motherboard&tag=bgfg-pc-builder-us-20
ASRock B560 Pro4 ATX LGA1200 Motherboard,4.5,$122.99,LGA1200,ATX,128 GB,4,https://www.amazon.com/dp/B08VH3DX2N?tag=bgfg-pc-builder-us-20
Biostar A520MH Micro ATX AM4 Motherboard,,,AM4,Micro ATX,64 GB,2,https://www.amazon.com/s?k=Biostar+A520MH+Micro+ATX+AM4+Motherboard&tag=bgfg-pc-builder-us-20
Gigabyte H370M D3H Micro ATX LGA1151 Motherboard,3.0,,LGA1151,Micro ATX,64 GB,4,https://www.amazon.com/s?k=Gigabyte+H370M+D3H+Micro+ATX+LGA1151+Motherboard&tag=bgfg-pc-builder-us-20
Gigabyte A520M AORUS ELITE Micro ATX AM4 Motherboard,4.0,,AM4,Micro ATX,128 GB,4,https://www.amazon.com/s?k=Gigabyte+A520M+AORUS+ELITE+Micro+ATX+AM4+Motherboard&tag=bgfg-pc-builder-us-20
Asus Z97-A/USB 3.1 ATX LGA1150 Motherboard,4.7,,LGA1150,ATX,32 GB,4,https://www.amazon.com/s?k=Asus+Z97-A%2FUSB+3.1+ATX+LGA1150+Motherboard&tag=bgfg-pc-builder-us-20
Asus TUF GAMING B860M-PLUS WIFI Micro ATX LGA1851 Motherboard,,$209.99,LGA1851,Micro ATX,256 GB,4,https://www.amazon.com/dp/B0DQ5ZS8NG?tag=bgfg-pc-builder-us-20
MSI H310M PRO-M2 PLUS Micro ATX LGA1151 Motherboard,,,LGA1151,Micro ATX,32 GB,2,https://www.amazon.com/s?k=MSI+H310M+PRO-M2+PLUS+Micro+ATX+LGA1151+Motherboard&tag=bgfg-pc-builder-us-20
Asus PRIME B840M-A WIFI Micro ATX AM5 Motherboard,,$508.76,AM5,Micro ATX,192 GB,4,https://www.amazon.com/dp/B0DP5GGZYK?tag=bgfg-pc-builder-us-20
Gigabyte H610M S2H V2 Micro ATX LGA1700 Motherboard,,,LGA1700,Micro ATX,96 GB,2,https://www.amazon.com/s?k=Gigabyte+H610M+S2H+V2+Micro+ATX+LGA1700+Motherboard&tag=bgfg-pc-builder-us-20
MSI MEG X570S ACE MAX ATX AM4 Motherboard,5.0,$359.99,AM4,ATX,128 GB,4,https://www.amazon.com/dp/B09BYY2NDV?tag=bgfg-pc-builder-us-20
Gigabyte Z390 AORUS XTREME EATX LGA1151 Motherboard,,,LGA1151,EATX,128 GB,4,https://www.amazon.com/s?k=Gigabyte+Z390+AORUS+XTREME+EATX+LGA1151+Motherboard&tag=bgfg-pc-builder-us-20
ASRock Fatal1ty X99M Killer Micro ATX LGA2011-3 Motherboard,5.0,,LGA2011-3,Micro ATX,64 GB,4,https://www.amazon.com/s?k=ASRock+Fatal1ty+X99M+Killer+Micro+ATX+LGA2011-3+Motherboard&tag=bgfg-pc-builder-us-20
MSI H110M Gaming Micro ATX LGA1151 Motherboard,4.5,,LGA1151,Micro ATX,32 GB,2,https://www.amazon.com/s?k=MSI+H110M+Gaming+Micro+ATX+LGA1151+Motherboard&tag=bgfg-pc-builder-us-20
Asus PRIME H310M-R R2.0 Micro ATX LGA1151 Motherboard,,$149.90,LGA1151,Micro ATX,32 GB,2,https://www.amazon.com/dp/B07L4KSDHC?tag=bgfg-pc-builder-us-20
Gigabyte Z890 AERO D EATX LGA1851 Motherboard,,,LGA1851,EATX,256 GB,4,https://www.amazon.com/s?k=Gigabyte+Z890+AERO+D+EATX+LGA1851+Motherboard&tag=bgfg-pc-builder-us-20
Gigabyte B760M D3HP Micro ATX LGA1700 Motherboard,,,LGA1700,Micro ATX,192 GB,4,https://www.amazon.com/s?k=Gigabyte+B760M+D3HP+Micro+ATX+LGA1700+Motherboard&tag=bgfg-pc-builder-us-20
ASRock Z790 Taichi Lite EATX LGA1700 Motherboard,,$349.99,LGA1700,EATX,192 GB,4,https://www.amazon.com/s?k=ASRock+Z790+Taichi+Lite+EATX+LGA1700+Motherboard&tag=bgfg-pc-builder-us-20
Gigabyte Z790 AORUS ELITE AX-W ATX LGA1700 Motherboard,,$454.00,LGA1700,ATX,192 GB,4,https://www.amazon.com/dp/B0C4ZXQ8KR?tag=bgfg-pc-builder-us-20
Gigabyte Z890 GAMING X WIFI7 ATX LGA1851 Motherboard,,$239.99,LGA1851,ATX,256 GB,4,https://www.amazon.com/dp/B0DJP9DBVS?tag=bgfg-pc-builder-us-20
MSI Z370 SLI PLUS ATX LGA1151 Motherboard,4.7,,LGA1151,ATX,64 GB,4,https://www.amazon.com/s?k=MSI+Z370+SLI+PLUS+ATX+LGA1151+Motherboard&tag=bgfg-pc-builder-us-20
MSI B365M-PRO-VH Micro ATX LGA1151 Motherboard,,,LGA1151,Micro ATX,32 GB,2,https://www.amazon.com/s?k=MSI+B365M-PRO-VH+Micro+ATX+LGA1151+Motherboard&tag=bgfg-pc-builder-us-20
Gigabyte Z370 AORUS Gaming 5 (rev. 1.0) ATX LGA1151 Motherboard,4.7,,LGA1151,ATX,64 GB,4,https://www.amazon.com/s?k=Gigabyte+Z370+AORUS+Gaming+5+%28rev.+1.0%29+ATX+LGA1151+Motherboard&tag=bgfg-pc-builder-us-20
Gigabyte B760 GAMING X AX DDR4 ATX LGA1700 Motherboard,,$222.49,LGA1700,ATX,128 GB,4,https://www.amazon.com/dp/B0BPMKWQ5Q?tag=bgfg-pc-builder-us-20
Asus ROG STRIX Z590-I GAMING WIFI Mini ITX LGA1200 Motherboard,4.8,$339.99,LGA1200,Mini ITX,64 GB,2,https://www.amazon.com/dp/B08VL2GRS9?tag=bgfg-pc-builder-us-20
Gigabyte B550M S2H Micro ATX AM4 Motherboard,4.7,,AM4,Micro ATX,64 GB,2,https://www.amazon.com/s?k=Gigabyte+B550M+S2H+Micro+ATX+AM4+Motherboard&tag=bgfg-pc-builder-us-20
Asus H61M-C Micro ATX LGA1155 Motherboard,4.0,,LGA1155,Micro ATX,16 GB,2,https://www.amazon.com/s?k=Asus+H61M-C+Micro+ATX+LGA1155+Motherboard&tag=bgfg-pc-builder-us-20
Asus TUF GAMING B760M-E D4 Micro ATX LGA1700 Motherboard,,,LGA1700,Micro ATX,128 GB,4,https://www.amazon.com/s?k=Asus+TUF+GAMING+B760M-E+D4+Micro+ATX+LGA1700+Motherboard&tag=bgfg-pc-builder-us-20
Asus PRIME B650M-A AX Micro ATX AM5 Motherboard,,$199.99,AM5,Micro ATX,128 GB,4,https://www.amazon.com/dp/B0BHMVFS77?tag=bgfg-pc-builder-us-20
Asus ROG MAXIMUS X HERO ATX LGA1151 Motherboard,5.0,,LGA1151,ATX,64 GB,4,https://www.amazon.com/s?k=Asus+ROG+MAXIMUS+X+HERO+ATX+LGA1151+Motherboard&tag=bgfg-pc-builder-us-20
