name,rating,price,socket/cpu,form factor,memory max,memory slots,link
MSI MPG X570S EDGE MAX WIFI ATX AM4 Motherboard,,$239.99,AM4,ATX,128 GB,4,https://www.amazon.com/dp/B09BYXFHLR?tag=bgfg-pc-builder-us-20
MSI MEG Z690 ACE EATX LGA1700 Motherboard,5.0,$539.99,LGA1700,EATX,128 GB,4,https://www.amazon.com/dp/B09KL9NY48?tag=bgfg-pc-builder-us-20
MSI B360 GAMING PLUS ATX LGA1151 Motherboard,4.6,,LGA1151,ATX,64 GB,4,https://www.amazon.com/s?k=MSI+B360+GAMING+PLUS+ATX+LGA1151+Motherboard&tag=bgfg-pc-builder-us-20
Gigabyte C246-WU4 ATX LGA1151 Motherboard,5.0,,LGA1151,ATX,128 GB,4,https://www.amazon.com/s?k=Gigabyte+C246-WU4+ATX+LGA1151+Motherboard&tag=bgfg-pc-builder-us-20
MSI B450M PRO-VDH Micro ATX AM4 Motherboard,4.6,,AM4,Micro ATX,64 GB,4,https://www.amazon.com/s?k=MSI+B450M+PRO-VDH+Micro+ATX+AM4+Motherboard&tag=bgfg-pc-builder-us-20
Asus Z10PA-D8 ATX Dual-CPU LGA2011-3 Motherboard,,$986.86,2 x LGA2011-3,ATX,512 GB,8,https://www.amazon.com/dp/B00NNICZAE?tag=bgfg-pc-builder-us-20
Gigabyte A620M H (rev. 1.0) Micro ATX AM5 Motherboard,,,AM5,Micro ATX,96 GB,2,https://www.amazon.com/s?k=Gigabyte+A620M+H+%28rev.+1.0%29+Micro+ATX+AM5+Motherboard&tag=bgfg-pc-builder-us-20
Gigabyte H310M S2H Micro ATX LGA1151 Motherboard,,,LGA1151,Micro ATX,32 GB,2,https://www.amazon.com/s?k=Gigabyte+H310M+S2H+Micro+ATX+LGA1151+Motherboard&tag=bgfg-pc-builder-us-20
MSI B250M BAZOOKA Micro ATX LGA1151 Motherboard,4.2,,LGA1151,Micro ATX,64 GB,4,https://www.amazon.com/s?k=MSI+B250M+BAZOOKA+Micro+ATX+LGA1151+Motherboard&tag=bgfg-pc-builder-us-20
Gigabyte GA-Z170X-Gaming 3 ATX LGA1151 Motherboard,4.6,,LGA1151,ATX,64 GB,4,https://www.amazon.com/s?k=Gigabyte+GA-Z170X-Gaming+3+ATX+LGA1151+Motherboard&tag=bgfg-pc-builder-us-20
Gigabyte GA-78LMT-USB3 Micro ATX AM3+ Motherboard,3.8,,AM3+,Micro ATX,32 GB,4,https://www.amazon.com/s?k=Gigabyte+GA-78LMT-USB3+Micro+ATX+AM3%2B+Motherboard&tag=bgfg-pc-builder-us-20
MSI MPG Z690 EDGE WIFI ATX LGA1700 Motherboard,,$279.99,LGA1700,ATX,128 GB,4,https://www.amazon.com/s?k=MSI+MPG+Z690+EDGE+WIFI+ATX+LGA1700+Motherboard&tag=bgfg-pc-builder-us-20
Asus ROG STRIX Z390-I GAMING Mini ITX LGA1151 Motherboard,4.5,,LGA1151,Mini ITX,64 GB,2,https://www.amazon.com/s?k=Asus+ROG+STRIX+Z390-I+GAMING+Mini+ITX+LGA1151+Motherboard&tag=bgfg-pc-builder-us-20
ASRock B550M/ac Micro ATX AM4 Motherboard,4.0,,AM4,Micro ATX,128 GB,4,https://www.amazon.com/s?k=ASRock+B550M%2Fac+Micro+ATX+AM4+Motherboard&tag=bgfg-pc-builder-us-20
Gigabyte B760M GAMING X AX DDR4 Micro ATX LGA1700 Motherboard,,$219.04,LGA1700,Micro ATX,128 GB,4,https://www.amazon.com/dp/B0BPMGLGD7?tag=bgfg-pc-builder-us-20
Asus SABERTOOTH X99 ATX LGA2011-3 Motherboard,4.9,,LGA2011-3,ATX,64 GB,8,https://www.amazon.com/s?k=Asus+SABERTOOTH+X99+ATX+LGA2011-3+Motherboard&tag=bgfg-pc-builder-us-20
Gigabyte GA-H110M-A Micro ATX LGA1151 Motherboard,4.1,,LGA1151,Micro ATX,32 GB,2,https://www.amazon.com/s?k=Gigabyte+GA-H110M-A+Micro+ATX+LGA1151+Motherboard&tag=bgfg-pc-builder-us-20
Asus ROG MAXIMUS XI FORMULA ATX LGA1151 Motherboard,4.6,,LGA1151,ATX,128 GB,4,https://www.amazon.com/s?k=Asus+ROG+MAXIMUS+XI+FORMULA+ATX+LGA1151+Motherboard&tag=bgfg-pc-builder-us-20
ASRock Fatal1ty B450 GAMING K4 ATX AM4 Motherboard,3.6,$169.99,AM4,ATX,64 GB,4,https://www.amazon.com/dp/B07FW5ZMHQ?tag=bgfg-pc-builder-us-20
MSI MAG B550M BAZOOKA Micro ATX AM4 Motherboard,4.8,$199.00,AM4,Micro ATX,128 GB,4,https://www.amazon.com/dp/B089D666KF?tag=bgfg-pc-builder-us-20
MSI B350M PRO-VDH Micro ATX AM4 Motherboard,4.1,,AM4,Micro ATX,64 GB,4,https://www.amazon.com/s?k=MSI+B350M+PRO-VDH+Micro+ATX+AM4+Motherboard&tag=bgfg-pc-builder-us-20
MSI B450I GAMING PLUS MAX WIFI Mini ITX AM4 Motherboard,4.5,,AM4,Mini ITX,64 GB,2,https://www.amazon.com/s?k=MSI+B450I+GAMING+PLUS+MAX+WIFI+Mini+ITX+AM4+Motherboard&tag=bgfg-pc-builder-us-20
Asus TUF GAMING B760M-PLUS WIFI Micro ATX LGA1700 Motherboard,,$189.99,LGA1700,Micro ATX,192 GB,4,https://www.amazon.com/dp/B0BZTB87BY?tag=bgfg-pc-builder-us-20
Asus MAXIMUS IX HERO ATX LGA1151 Motherboard,4.8,,LGA1151,ATX,64 GB,4,https://www.amazon.com/s?k=Asus+MAXIMUS+IX+HERO+ATX+LGA1151+Motherboard&tag=bgfg-pc-builder-us-20
Gigabyte X570 UD ATX AM4 Motherboard,3.0,$195.84,AM4,ATX,128 GB,4,https://www.amazon.com/dp/B07WL68L6M?tag=bgfg-pc-builder-us-20
MSI PRO Z690-A ATX LGA1700 Motherboard,5.0,$179.54,LGA1700,ATX,128 GB,4,https://www.amazon.com/dp/B09KKYS967?tag=bgfg-pc-builder-us-20
Asus PRIME Z790M-PLUS D4 Micro ATX LGA1700 Motherboard,,$199.99,LGA1700,Micro ATX,128 GB,4,https://www.amazon.com/dp/B0BHXSR2C5?tag=bgfg-pc-builder-us-20
NZXT N7-Z69XT-W1 ATX LGA1700 Motherboard,4.7,$259.99,LGA1700,ATX,128 GB,4,https://www.amazon.com/dp/B09ZNN4GP4?tag=bgfg-pc-builder-us-20
MSI PRO Z890-A WIFI ATX LGA1851 Motherboard,,$289.99,LGA1851,ATX,256 GB,4,https://www.amazon.com/dp/B0DH6W5M6R?tag=bgfg-pc-builder-us-20
Gigabyte B660 GAMING X AX DDR4 ATX LGA1700 Motherboard,4.9,$139.99,LGA1700,ATX,128 GB,4,https://www.amazon.com/dp/B09SVZRM13?tag=bgfg-pc-builder-us-20
Asus ROG STRIX Z390-H GAMING ATX LGA1151 Motherboard,4.5,$199.99,LGA1151,ATX,128 GB,4,https://www.amazon.com/dp/B07HM3FMRB?tag=bgfg-pc-builder-us-20
Gigabyte B560M DS3H V2 Micro ATX LGA1200 Motherboard,,$123.00,LGA1200,Micro ATX,128 GB,4,https://www.amazon.com/dp/B09M98PY9R?tag=bgfg-pc-builder-us-20
ASRock H510M-HDV/M.2 Micro ATX LGA1200 Motherboard,,$79.98,LGA1200,Micro ATX,64 GB,2,https://www.amazon.com/dp/B08XNJNX5D?tag=bgfg-pc-builder-us-20
Gigabyte B450 Gaming X ATX AM4 Motherboard,3.2,,AM4,ATX,64 GB,4,https://www.amazon.com/s?k=Gigabyte+B450+Gaming+X+ATX+AM4+Motherboard&tag=bgfg-pc-builder-us-20
MSI B460M-A PRO Micro ATX LGA1200 Motherboard,4.3,,LGA1200,Micro ATX,64 GB,2,https://www.amazon.com/s?k=MSI+B460M-A+PRO+Micro+ATX+LGA1200+Motherboard&tag=bgfg-pc-builder-us-20
ASRock X470 Taichi ATX AM4 Motherboard,4.2,,AM4,ATX,64 GB,4,https://www.amazon.com/s?k=ASRock+X470+Taichi+ATX+AM4+Motherboard&tag=bgfg-pc-builder-us-20
Asus ROG Crosshair VIII Impact Mini DTX AM4 Motherboard,4.6,$419.99,AM4,Mini DTX,64 GB,2,https://www.amazon.com/dp/B07Y2NMRBP?tag=bgfg-pc-builder-us-20
Asus ProArt B550-CREATOR ATX AM4 Motherboard,,$239.99,AM4,ATX,128 GB,4,https://www.amazon.com/dp/B08ZS73B4Y?tag=bgfg-pc-builder-us-20
ASRock Z790 Taichi EATX LGA1700 Motherboard,,$479.99,LGA1700,EATX,128 GB,4,https://www.amazon.com/s?k=ASRock+Z790+Taichi+EATX+LGA1700+Motherboard&tag=bgfg-pc-builder-us-20
Asus ROG Crosshair VII Hero ATX AM4 Motherboard,4.9,,AM4,ATX,64 GB,4,https://www.amazon.com/s?k=Asus+ROG+Crosshair+VII+Hero+ATX+AM4+Motherboard&tag=bgfg-pc-builder-us-20
Asus ROG MAXIMUS XIII HERO ATX LGA1200 Motherboard,5.0,$244.99,LGA1200,ATX,128 GB,4,https://www.amazon.com/dp/B08T6BHQC8?tag=bgfg-pc-builder-us-20
Gigabyte Z890 AERO G ATX LGA1851 Motherboard,,$349.99,LGA1851,ATX,256 GB,4,https://www.amazon.com/dp/B0DJP9KLLD?tag=bgfg-pc-builder-us-20
Asus TUF GAMING B860-PLUS WIFI ATX LGA1851 Motherboard,,$219.99,LGA1851,ATX,256 GB,4,https://www.amazon.com/dp/B0DFPNHCMX?tag=bgfg-pc-builder-us-20
MSI MAG B460M MORTAR WIFI Micro ATX LGA1200 Motherboard,5.0,,LGA1200,Micro ATX,128 GB,4,https://www.amazon.com/s?k=MSI+MAG+B460M+MORTAR+WIFI+Micro+ATX+LGA1200+Motherboard&tag=bgfg-pc-builder-us-20
Asus PRIME B760M-R D4 Micro ATX LGA1700 Motherboard,,,LGA1700,Micro ATX,64 GB,2,https://www.amazon.com/s?k=Asus+PRIME+B760M-R+D4+Micro+ATX+LGA1700+Motherboard&tag=bgfg-pc-builder-us-20
Asus PRIME B840M-A WIFI-CSM Micro ATX AM5 Motherboard,,$169.99,AM5,Micro ATX,192 GB,4,https://www.amazon.com/dp/B0DPLPL5KJ?tag=bgfg-pc-builder-us-20
Gigabyte B365 HD3 ATX LGA1151 Motherboard,4.0,,LGA1151,ATX,64 GB,4,https://www.amazon.com/s?k=Gigabyte+B365+HD3+ATX+LGA1151+Motherboard&tag=bgfg-pc-builder-us-20
MSI PRO B860M-A WIFI Micro ATX LGA1851 Motherboard,,,LGA1851,Micro ATX,256 GB,4,https://www.amazon.com/s?k=MSI+PRO+B860M-A+WIFI+Micro+ATX+LGA1851+Motherboard&tag=bgfg-pc-builder-us-20
Asus P5QProTurbo ATX LGA775 Motherboard,,,LGA775,ATX,16 GB,4,https://www.amazon.com/s?k=Asus+P5QProTurbo+ATX+LGA775+Motherboard&tag=bgfg-pc-builder-us-20
MSI MPG Z490 GAMING CARBON WIFI ATX LGA1200 Motherboard,4.6,$149.49,LGA1200,ATX,128 GB,4,https://www.amazon.com/dp/B0876HV8T3?tag=bgfg-pc-builder-us-20
Gigabyte B450M H Micro ATX AM4 Motherboard,4.0,$107.90,AM4,Micro ATX,32 GB,2,https://www.amazon.com/dp/B084KP738D?tag=bgfg-pc-builder-us-20
Asus H110M-R Micro ATX LGA1151 Motherboard,,,LGA1151,Micro ATX,32 GB,2,https://www.amazon.com/s?k=Asus+H110M-R+Micro+ATX+LGA1151+Motherboard&tag=bgfg-pc-builder-us-20
MSI MEG Z890 UNIFY-X ATX LGA1851 Motherboard,,,LGA1851,ATX,128 GB,2,https://www.amazon.com/s?k=MSI+MEG+Z890+UNIFY-X+ATX+LGA1851+Motherboard&tag=bgfg-pc-builder-us-20
Asus PRIME B460-PLUS ATX LGA1200 Motherboard,4.0,$114.99,LGA1200,ATX,128 GB,4,https://www.amazon.com/s?k=Asus+PRIME+B460-PLUS+ATX+LGA1200+Motherboard&tag=bgfg-pc-builder-us-20
MSI H510M PRO Micro ATX LGA1200 Motherboard,5.0,$89.99,LGA1200,Micro ATX,64 GB,2,https://www.amazon.com/dp/B08WCF4SF3?tag=bgfg-pc-builder-us-20
ASRock H470M-HVS Micro ATX LGA1200 Motherboard,,$69.99,LGA1200,Micro ATX,64 GB,2,https://www.amazon.com/s?k=ASRock+H470M-HVS+Micro+ATX+LGA1200+Motherboard&tag=bgfg-pc-builder-us-20
MSI MEG X570 ACE ATX AM4 Motherboard,4.6,,AM4,ATX,128 GB,4,https://www.amazon.com/s?k=MSI+MEG+X570+ACE+ATX+AM4+Motherboard&tag=bgfg-pc-builder-us-20
Gigabyte Z690 UD AX DDR4 ATX LGA1700 Motherboard,3.8,$179.99,LGA1700,ATX,128 GB,4,https://www.amazon.com/dp/B09JZGTYXJ?tag=bgfg-pc-builder-us-20
Asus STRIX X370-F GAMING ATX AM4 Motherboard,4.8,,AM4,ATX,64 GB,4,https://www.amazon.com/s?k=Asus+STRIX+X370-F+GAMING+ATX+AM4+Motherboard&tag=bgfg-pc-builder-us-20
Asus M5A78L-M PLUS/USB3 Micro ATX AM3+ Motherboard,3.6,,AM3+,Micro ATX,32 GB,4,https://www.amazon.com/s?k=Asus+M5A78L-M+PLUS%2FUSB3+Micro+ATX+AM3%2B+Motherboard&tag=bgfg-pc-builder-us-20
Asus X99-A II ATX LGA2011-3 Motherboard,4.5,,LGA2011-3,ATX,128 GB,8,https://www.amazon.com/s?k=Asus+X99-A+II+ATX+LGA2011-3+Motherboard&tag=bgfg-pc-builder-us-20
ASRock TRX40 Creator ATX sTRX4 Motherboard,5.0,,sTRX4,ATX,256 GB,8,https://www.amazon.com/s?k=ASRock+TRX40+Creator+ATX+sTRX4+Motherboard&tag=bgfg-pc-builder-us-20
MSI B350 GAMING PLUS ATX AM4 Motherboard,4.6,,AM4,ATX,64 GB,4,https://www.amazon.com/s?k=MSI+B350+GAMING+PLUS+ATX+AM4+Motherboard&tag=bgfg-pc-builder-us-20
Asus PRIME B760M-A AX6 II Micro ATX LGA1700 Motherboard,,,LGA1700,Micro ATX,192 GB,4,https://www.amazon.com/s?k=Asus+PRIME+B760M-A+AX6+II+Micro+ATX+LGA1700+Motherboard&tag=bgfg-pc-builder-us-20
MSI PRO Z790-A WIFI DDR4 ATX LGA1700 Motherboard,,$269.99,LGA1700,ATX,128 GB,4,https://www.amazon.com/s?k=MSI+PRO+Z790-A+WIFI+DDR4+ATX+LGA1700+Motherboard&tag=bgfg-pc-builder-us-20
MSI PRO-B660M-A-CEC-WIFI-DDR4 Micro ATX LGA1700 Motherboard,,,LGA1700,Micro ATX,128 GB,4,https://www.amazon.com/s?k=MSI+PRO-B660M-A-CEC-WIFI-DDR4+Micro+ATX+LGA1700+Motherboard&tag=bgfg-pc-builder-us-20
Gigabyte Z790 D AC ATX LGA1700 Motherboard,,$189.99,LGA1700,ATX,192 GB,4,https://www.amazon.com/dp/B0CTTWH6TD?tag=bgfg-pc-builder-us-20
Asus Z170-AR ATX LGA1151 Motherboard,4.5,,LGA1151,ATX,64 GB,4,https://www.amazon.com/s?k=Asus+Z170-AR+ATX+LGA1151+Motherboard&tag=bgfg-pc-builder-us-20
Asus ROG Crosshair VIII Extreme EATX AM4 Motherboard,5.0,$906.99,AM4,EATX,128 GB,4,https://www.amazon.com/dp/B09D7M81TD?tag=bgfg-pc-builder-us-20
ASRock A320M Micro ATX AM4 Motherboard,,,AM4,Micro ATX,32 GB,2,https://www.amazon.com/s?k=ASRock+A320M+Micro+ATX+AM4+Motherboard&tag=bgfg-pc-builder-us-20
MSI MPG Z390 GAMING PRO CARBON AC ATX LGA1151 Motherboard,4.5,,LGA1151,ATX,128 GB,4,https://www.amazon.com/s?k=MSI+MPG+Z390+GAMING+PRO+CARBON+AC+ATX+LGA1151+Motherboard&tag=bgfg-pc-builder-us-20
Gigabyte Z590 VISION G ATX LGA1200 Motherboard,5.0,$159.99,LGA1200,ATX,128 GB,4,https://www.amazon.com/dp/B08W8PH5B9?tag=bgfg-pc-builder-us-20
Asus ROG STRIX B850-E GAMING WIFI ATX AM5 Motherboard,,$349.99,AM5,ATX,256 GB,4,https://www.amazon.com/dp/B0DPLQXPG2?tag=bgfg-pc-builder-us-20
Asus ROG STRIX B660-F GAMING WIFI ATX LGA1700 Motherboard,,$275.94,LGA1700,ATX,128 GB,4,https://www.amazon.com/s?k=Asus+ROG+STRIX+B660-F+GAMING+WIFI+ATX+LGA1700+Motherboard&tag=bgfg-pc-builder-us-20
Asus PRIME B650M-A II Micro ATX AM5 Motherboard,,,AM5,Micro ATX,128 GB,4,https://www.amazon.com/s?k=Asus+PRIME+B650M-A+II+Micro+ATX+AM5+Motherboard&tag=bgfg-pc-builder-us-20
Gigabyte Z690 AORUS MASTER EATX LGA1700 Motherboard,4.5,$531.09,LGA1700,EATX,128 GB,4,https://www.amazon.com/dp/B09KC6V6D6?tag=bgfg-pc-builder-us-20
Gigabyte GA-B75M-D3H Micro ATX LGA1155 Motherboard,3.7,$108.50,LGA1155,Micro ATX,32 GB,4,https://www.amazon.com/dp/B007R9CRGW?tag=bgfg-pc-builder-us-20
Asus PRIME H610M-A WIFI-CSM Micro ATX LGA1700 Motherboard,,,LGA1700,Micro ATX,96 GB,2,https://www.amazon.com/s?k=Asus+PRIME+H610M-A+WIFI-CSM+Micro+ATX+LGA1700+Motherboard&tag=bgfg-pc-builder-us-20
Asus PRIME H310M-K R2.0 Micro ATX LGA1151 Motherboard,4.0,$123.80,LGA1151,Micro ATX,32 GB,2,https://www.amazon.com/dp/B07G347C82?tag=bgfg-pc-builder-us-20
MSI MAG Z690 TOMAHAWK WIFI ATX LGA1700 Motherboard,5.0,$299.00,LGA1700,ATX,128 GB,4,https://www.amazon.com/dp/B09PX5WHMB?tag=bgfg-pc-builder-us-20
Asus TUF Z370 Plus Gaming ATX LGA1151 Motherboard,5.0,,LGA1151,ATX,64 GB,4,https://www.amazon.com/s?k=Asus+TUF+Z370+Plus+Gaming+ATX+LGA1151+Motherboard&tag=bgfg-pc-builder-us-20
Gigabyte GA-B85M-D3H Micro ATX LGA1150 Motherboard,4.2,,LGA1150,Micro ATX,32 GB,4,https://www.amazon.com/s?k=Gigabyte+GA-B85M-D3H+Micro+ATX+LGA1150+Motherboard&tag=bgfg-pc-builder-us-20
Gigabyte B550 AORUS ELITE AX V3 (rev. 1.5) ATX AM4 Motherboard,,,AM4,ATX,128 GB,4,https://www.amazon.com/s?k=Gigabyte+B550+AORUS+ELITE+AX+V3+%28rev.+1.5%29+ATX+AM4+Motherboard&tag=bgfg-pc-builder-us-20
Gigabyte Z690 AORUS ELITE AX DDR4 ATX LGA1700 Motherboard,4.2,$199.99,LGA1700,ATX,128 GB,4,https://www.amazon.com/dp/B09J6BWK2Z?tag=bgfg-pc-builder-us-20
ASRock Z690 Phantom Gaming-ITX/TB4 Mini ITX LGA1700 Motherboard,5.0,$272.86,LGA1700,Mini ITX,64 GB,2,https://www.amazon.com/dp/B09SHPV76R?tag=bgfg-pc-builder-us-20
MSI B350 PC MATE ATX AM4 Motherboard,4.6,,AM4,ATX,64 GB,4,https://www.amazon.com/s?k=MSI+B350+PC+MATE+ATX+AM4+Motherboard&tag=bgfg-pc-builder-us-20
ASRock X570 Pro4 ATX AM4 Motherboard,4.2,$169.00,AM4,ATX,128 GB,4,https://www.amazon.com/dp/B07THYPNC1?tag=bgfg-pc-builder-us-20
Gigabyte B550 AORUS ELITE ATX AM4 Motherboard,4.7,$138.02,AM4,ATX,128 GB,4,https://www.amazon.com/dp/B089FT8G44?tag=bgfg-pc-builder-us-20
ASRock B850 Pro-A WiFi ATX AM5 Motherboard,,,AM5,ATX,256 GB,4,https://www.amazon.com/s?k=ASRock+B850+Pro-A+WiFi+ATX+AM5+Motherboard&tag=bgfg-pc-builder-us-20
Gigabyte B650 AORUS PRO AX ATX AM5 Motherboard,,$432.00,AM5,ATX,128 GB,4,https://www.amazon.com/dp/B0BJDWH2PM?tag=bgfg-pc-builder-us-20
Asus ROG STRIX Z890-F GAMING WIFI ATX LGA1851 Motherboard,,,LGA1851,ATX,192 GB,4,https://www.amazon.com/s?k=Asus+ROG+STRIX+Z890-F+GAMING+WIFI+ATX+LGA1851+Motherboard&tag=bgfg-pc-builder-us-20
MSI Z590 PRO WIFI ATX LGA1200 Motherboard,3.7,$292.95,LGA1200,ATX,128 GB,4,https://www.amazon.com/dp/B08WBYQQ8C?tag=bgfg-pc-builder-us-20
ASRock Z790M PG LIGHTNING/D4 Micro ATX LGA1700 Motherboard,,$179.99,LGA1700,Micro ATX,128 GB,4,https://www.amazon.com/s?k=ASRock+Z790M+PG+LIGHTNING%2FD4+Micro+ATX+LGA1700+Motherboard&tag=bgfg-pc-builder-us-20
ASRock AB350 Pro4 ATX AM4 Motherboard,4.3,,AM4,ATX,64 GB,4,https://www.amazon.com/s?k=ASRock+AB350+Pro4+ATX+AM4+Motherboard&tag=bgfg-pc-builder-us-20
Asus PRIME H510M-E Micro ATX LGA1200 Motherboard,,$85.99,LGA1200,Micro ATX,64 GB,2,https://www.amazon.com/dp/B08WRX47LN?tag=bgfg-pc-builder-us-20
Gigabyte Z890 AORUS MASTER ATX LGA1851 Motherboard,,$549.99,LGA1851,ATX,256 GB,4,https://www.amazon.com/dp/B0DJP9LCYC?tag=bgfg-pc-builder-us-20
MSI MAG B660M MORTAR WIFI DDR4 Micro ATX LGA1700 Motherboard,4.8,$159.99,LGA1700,Micro ATX,128 GB,4,https://www.amazon.com/dp/B09PXD16F6?tag=bgfg-pc-builder-us-20
Gigabyte B760 DS3H AC ATX LGA1700 Motherboard,,$154.99,LGA1700,ATX,192 GB,4,https://www.amazon.com/dp/B0CTTW2MVG?tag=bgfg-pc-builder-us-20
Asus ROG Crosshair VIII Hero ATX AM4 Motherboard,4.6,$299.29,AM4,ATX,128 GB,4,https://www.amazon.com/dp/B07SYW3RT2?tag=bgfg-pc-builder-us-20
Asus Prime Z370-P ATX LGA1151 Motherboard,4.4,,LGA1151,ATX,64 GB,4,https://www.amazon.com/s?k=Asus+Prime+Z370-P+ATX+LGA1151+Motherboard&tag=bgfg-pc-builder-us-20
Gigabyte B760M D3HP DDR4 Micro ATX LGA1700 Motherboard,,,LGA1700,Micro ATX,128 GB,4,https://www.amazon.com/s?k=Gigabyte+B760M+D3HP+DDR4+Micro+ATX+LGA1700+Motherboard&tag=bgfg-pc-builder-us-20
MSI B360M BAZOOKA Micro ATX LGA1151 Motherboard,4.0,,LGA1151,Micro ATX,64 GB,4,https://www.amazon.com/s?k=MSI+B360M+BAZOOKA+Micro+ATX+LGA1151+Motherboard&tag=bgfg-pc-builder-us-20
Gigabyte X570 GAMING X ATX AM4 Motherboard,4.4,$217.29,AM4,ATX,128 GB,4,https://www.amazon.com/dp/B07SQJZDTX?tag=bgfg-pc-builder-us-20
Gigabyte B760 DS3H ATX LGA1700 Motherboard,,,LGA1700,ATX,128 GB,4,https://www.amazon.com/s?k=Gigabyte+B760+DS3H+ATX+LGA1700+Motherboard&tag=bgfg-pc-builder-us-20
Asus PRIME B450M-K Micro ATX AM4 Motherboard,3.7,$133.90,AM4,Micro ATX,32 GB,2,https://www.amazon.com/dp/B07F6XSD3S?tag=bgfg-pc-builder-us-20
Asus ROG STRIX X99 GAMING ATX LGA2011-3 Motherboard,3.9,,LGA2011-3,ATX,128 GB,8,https://www.amazon.com/s?k=Asus+ROG+STRIX+X99+GAMING+ATX+LGA2011-3+Motherboard&tag=bgfg-pc-builder-us-20
Asus TUF GAMING B550M-E WIFI Micro ATX AM4 Motherboard,,,AM4,Micro ATX,128 GB,4,https://www.amazon.com/s?k=Asus+TUF+GAMING+B550M-E+WIFI+Micro+ATX+AM4+Motherboard&tag=bgfg-pc-builder-us-20
Asus PRIME H610M-A D4-CSM Micro ATX LGA1700 Motherboard,,$109.99,LGA1700,Micro ATX,64 GB,2,https://www.amazon.com/dp/B09NWFMM9G?tag=bgfg-pc-builder-us-20
Asus TUF GAMING B660-PLUS WIFI D4 ATX LGA1700 Motherboard,5.0,$218.84,LGA1700,ATX,128 GB,4,https://www.amazon.com/s?k=Asus+TUF+GAMING+B660-PLUS+WIFI+D4+ATX+LGA1700+Motherboard&tag=bgfg-pc-builder-us-20
Gigabyte B760 DS3H AC DDR4 ATX LGA1700 Motherboard,,$149.99,LGA1700,ATX,128 GB,4,https://www.amazon.com/dp/B0BSNYN4XQ?tag=bgfg-pc-builder-us-20
ASRock A320M-HDV Micro ATX AM4 Motherboard,4.0,,AM4,Micro ATX,32 GB,2,https://www.amazon.com/s?k=ASRock+A320M-HDV+Micro+ATX+AM4+Motherboard&tag=bgfg-pc-builder-us-20
MSI B450I GAMING PLUS AC Mini ITX AM4 Motherboard,4.3,,AM4,Mini ITX,64 GB,2,https://www.amazon.com/s?k=MSI+B450I+GAMING+PLUS+AC+Mini+ITX+AM4+Motherboard&tag=bgfg-pc-builder-us-20
ASRock B660 Pro RS ATX LGA1700 Motherboard,,$175.14,LGA1700,ATX,128 GB,4,https://www.amazon.com/dp/B09NZLRBNP?tag=bgfg-pc-builder-us-20
Asus TUF GAMING B550M-PLUS (WI-FI) Micro ATX AM4 Motherboard,4.4,$206.72,AM4,Micro ATX,128 GB,4,https://www.amazon.com/dp/B088VXTBWR?tag=bgfg-pc-builder-us-20
Asus PRIME B660M-A D4 Micro ATX LGA1700 Motherboard,4.4,$109.99,LGA1700,Micro ATX,128 GB,4,https://www.amazon.com/dp/B09NWF1JQC?tag=bgfg-pc-builder-us-20
ASRock X670E Taichi Carrara EATX AM5 Motherboard,,$542.00,AM5,EATX,128 GB,4,https://www.amazon.com/dp/B0BGPGH6WG?tag=bgfg-pc-builder-us-20
Asus Prime B760M-K Micro ATX LGA1700 Motherboard,,,LGA1700,Micro ATX,96 GB,2,https://www.amazon.com/s?k=Asus+Prime+B760M-K+Micro+ATX+LGA1700+Motherboard&tag=bgfg-pc-builder-us-20
ASRock B760I Lightning WiFi Mini ITX LGA1700 Motherboard,,$184.99,LGA1700,Mini ITX,96 GB,2,https://www.amazon.com/s?k=ASRock+B760I+Lightning+WiFi+Mini+ITX+LGA1700+Motherboard&tag=bgfg-pc-builder-us-20
Asus PRIME B650M-A-CSM Micro ATX AM5 Motherboard,,$169.99,AM5,Micro ATX,128 GB,4,https://www.amazon.com/dp/B0BPRK5WVM?tag=bgfg-pc-builder-us-20
ASRock Z790 Riptide WiFi ATX LGA1700 Motherboard,,,LGA1700,ATX,192 GB,4,https://www.amazon.com/s?k=ASRock+Z790+Riptide+WiFi+ATX+LGA1700+Motherboard&tag=bgfg-pc-builder-us-20
Gigabyte Z790I AORUS ULTRA Mini ITX LGA1700 Motherboard,,$319.99,LGA1700,Mini ITX,96 GB,2,https://www.amazon.com/dp/B0BZQ43XXL?tag=bgfg-pc-builder-us-20
Asus Z97-A ATX LGA1150 Motherboard,4.7,$137.00,LGA1150,ATX,32 GB,4,https://www.amazon.com/dp/B00K2MAU5Q?tag=bgfg-pc-builder-us-20
Gigabyte GA-A320M-H Micro ATX AM4 Motherboard,3.5,$168.68,AM4,Micro ATX,32 GB,2,https://www.amazon.com/dp/B07JCZLF22?tag=bgfg-pc-builder-us-20
Gigabyte B650E AORUS MASTER ATX AM5 Motherboard,2.0,$398.34,AM5,ATX,128 GB,4,https://www.amazon.com/dp/B0BH7X5VW3?tag=bgfg-pc-builder-us-20
Asus ROG MAXIMUS Z690 HERO ATX LGA1700 Motherboard,5.0,$619.29,LGA1700,ATX,128 GB,4,https://www.amazon.com/dp/B09J1PD7P6?tag=bgfg-pc-builder-us-20
Gigabyte B760M GAMING WIFI PLUS Micro ATX LGA1700 Motherboard,,,LGA1700,Micro ATX,96 GB,2,https://www.amazon.com/s?k=Gigabyte+B760M+GAMING+WIFI+PLUS+Micro+ATX+LGA1700+Motherboard&tag=bgfg-pc-builder-us-20
Asus TUF B365M-PLUS GAMING Micro ATX LGA1151 Motherboard,3.7,,LGA1151,Micro ATX,64 GB,4,https://www.amazon.com/s?k=Asus+TUF+B365M-PLUS+GAMING+Micro+ATX+LGA1151+Motherboard&tag=bgfg-pc-builder-us-20
Gigabyte B760M D3H Micro ATX LGA1700 Motherboard,,,LGA1700,Micro ATX,192 GB,4,https://www.amazon.com/s?k=Gigabyte+B760M+D3H+Micro+ATX+LGA1700+Motherboard&tag=bgfg-pc-builder-us-20
MSI B365M PRO-VDH Micro ATX LGA1151 Motherboard,5.0,,LGA1151,Micro ATX,64 GB,4,https://www.amazon.com/s?k=MSI+B365M+PRO-VDH+Micro+ATX+LGA1151+Motherboard&tag=bgfg-pc-builder-us-20
Asus PRIME Z790-P WIFI D4 ATX LGA1700 Motherboard,,$239.99,LGA1700,ATX,128 GB,4,https://www.amazon.com/dp/B0BG6ML17L?tag=bgfg-pc-builder-us-20
Gigabyte Z590 UD AC ATX LGA1200 Motherboard,4.5,$167.99,LGA1200,ATX,128 GB,4,https://www.amazon.com/dp/B083HZ6D35?tag=bgfg-pc-builder-us-20
MSI PRO B760M-E DDR4 Micro ATX LGA1700 Motherboard,,,LGA1700,Micro ATX,64 GB,2,https://www.amazon.com/s?k=MSI+PRO+B760M-E+DDR4+Micro+ATX+LGA1700+Motherboard&tag=bgfg-pc-builder-us-20
ASRock B450M-HDV Micro ATX AM4 Motherboard,3.3,$104.50,AM4,Micro ATX,32 GB,2,https://www.amazon.com/dp/B07FVKWLQK?tag=bgfg-pc-builder-us-20
MSI MPG Z890 EDGE TI WIFI ATX LGA1851 Motherboard,,,LGA1851,ATX,256 GB,4,https://www.amazon.com/s?k=MSI+MPG+Z890+EDGE+TI+WIFI+ATX+LGA1851+Motherboard&tag=bgfg-pc-builder-us-20
ASRock X570 Steel Legend ATX AM4 Motherboard,4.5,$192.77,AM4,ATX,128 GB,4,https://www.amazon.com/dp/B07THJ8JSD?tag=bgfg-pc-builder-us-20
Asus PRIME Z590-A ATX LGA1200 Motherboard,4.6,$159.99,LGA1200,ATX,128 GB,4,https://www.amazon.com/dp/B08SYWZW4S?tag=bgfg-pc-builder-us-20
Biostar A320MH Micro ATX AM4 Motherboard,,$112.00,AM4,Micro ATX,32 GB,2,https://www.amazon.com/dp/B07FZLWSVR?tag=bgfg-pc-builder-us-20
ASRock B660M-C Micro ATX LGA1700 Motherboard,,,LGA1700,Micro ATX,128 GB,4,https://www.amazon.com/s?k=ASRock+B660M-C+Micro+ATX+LGA1700+Motherboard&tag=bgfg-pc-builder-us-20
Gigabyte B360M DS3H Micro ATX LGA1151 Motherboard,4.3,,LGA1151,Micro ATX,64 GB,4,https://www.amazon.com/s?k=Gigabyte+B360M+DS3H+Micro+ATX+LGA1151+Motherboard&tag=bgfg-pc-builder-us-20
ASRock B365 Phantom Gaming 4 ATX LGA1151 Motherboard,4.0,,LGA1151,ATX,128 GB,4,https://www.amazon.com/s?k=ASRock+B365+Phantom+Gaming+4+ATX+LGA1151+Motherboard&tag=bgfg-pc-builder-us-20
ASRock B650 Pro RS WiFi ATX AM5 Motherboard,,,AM5,ATX,192 GB,4,https://www.amazon.com/s?k=ASRock+B650+Pro+RS+WiFi+ATX+AM5+Motherboard&tag=bgfg-pc-builder-us-20
Gigabyte B760M AORUS ELITE X AX Micro ATX LGA1700 Motherboard,,,LGA1700,Micro ATX,192 GB,4,https://www.amazon.com/s?k=Gigabyte+B760M+AORUS+ELITE+X+AX+Micro+ATX+LGA1700+Motherboard&tag=bgfg-pc-builder-us-20
Gigabyte B850M D3HP Micro ATX AM5 Motherboard,,$151.77,AM5,Micro ATX,256 GB,4,https://www.amazon.com/dp/B0DQNQM897?tag=bgfg-pc-builder-us-20
Gigabyte A520M K Micro ATX AM4 Motherboard,,,AM4,Micro ATX,64 GB,2,https://www.amazon.com/s?k=Gigabyte+A520M+K+Micro+ATX+AM4+Motherboard&tag=bgfg-pc-builder-us-20
ASRock B760M-H/M.2 Micro ATX LGA1700 Motherboard,,$89.99,LGA1700,Micro ATX,96 GB,2,https://www.amazon.com/dp/B0CBNN8PYT?tag=bgfg-pc-builder-us-20
Gigabyte GA-A320M-S2H V2 Micro ATX AM4 Motherboard,4.0,,AM4,Micro ATX,32 GB,2,https://www.amazon.com/s?k=Gigabyte+GA-A320M-S2H+V2+Micro+ATX+AM4+Motherboard&tag=bgfg-pc-builder-us-20
Asus PRIME B460M-A Micro ATX LGA1200 Motherboard,4.0,$179.00,LGA1200,Micro ATX,128 GB,4,https://www.amazon.com/dp/B087M19S5P?tag=bgfg-pc-builder-us-20
Gigabyte H310M H Micro ATX LGA1151 Motherboard,4.0,,LGA1151,Micro ATX,32 GB,2,https://www.amazon.com/s?k=Gigabyte+H310M+H+Micro+ATX+LGA1151+Motherboard&tag=bgfg-pc-builder-us-20
Asus Z890 AYW GAMING WIFI W ATX LGA1851 Motherboard,,,LGA1851,ATX,192 GB,4,https://www.amazon.com/s?k=Asus+Z890+AYW+GAMING+WIFI+W+ATX+LGA1851+Motherboard&tag=bgfg-pc-builder-us-20
Gigabyte B550 GAMING X ATX AM4 Motherboard,4.8,,AM4,ATX,128 GB,4,https://www.amazon.com/s?k=Gigabyte+B550+GAMING+X+ATX+AM4+Motherboard&tag=bgfg-pc-builder-us-20
Asus Pro B560M-CT/CSM Micro ATX LGA1200 Motherboard,,$119.99,LGA1200,Micro ATX,128 GB,4,https://www.amazon.com/dp/B0979RYQ87?tag=bgfg-pc-builder-us-20
Asus PRIME A320M-A Micro ATX AM4 Motherboard,,$114.99,AM4,Micro ATX,64 GB,4,https://www.amazon.com/dp/B073WCCWSX?tag=bgfg-pc-builder-us-20
Gigabyte Z390 AORUS ELITE ATX LGA1151 Motherboard,4.5,$265.38,LGA1151,ATX,128 GB,4,https://www.amazon.com/dp/B07HRWJ555?tag=bgfg-pc-builder-us-20
Gigabyte Z690 GAMING X DDR4 ATX LGA1700 Motherboard,4.3,$179.99,LGA1700,ATX,128 GB,4,https://www.amazon.com/dp/B09J5TC4F8?tag=bgfg-pc-builder-us-20
Gigabyte B450 AORUS PRO ATX AM4 Motherboard,4.3,,AM4,ATX,64 GB,4,https://www.amazon.com/s?k=Gigabyte+B450+AORUS+PRO+ATX+AM4+Motherboard&tag=bgfg-pc-builder-us-20
Gigabyte B550M AORUS PRO-P Micro ATX AM4 Motherboard,4.6,$155.22,AM4,Micro ATX,128 GB,4,https://www.amazon.com/dp/B08L74NCPQ?tag=bgfg-pc-builder-us-20
MSI PRO B650-VC WIFI II ATX AM5 Motherboard,,,AM5,ATX,96 GB,2,https://www.amazon.com/s?k=MSI+PRO+B650-VC+WIFI+II+ATX+AM5+Motherboard&tag=bgfg-pc-builder-us-20
ASRock B650E TAICHI EATX AM5 Motherboard,,$369.99,AM5,EATX,128 GB,4,https://www.amazon.com/s?k=ASRock+B650E+TAICHI+EATX+AM5+Motherboard&tag=bgfg-pc-builder-us-20
Gigabyte H510M H Micro ATX LGA1200 Motherboard,,$86.67,LGA1200,Micro ATX,64 GB,2,https://www.amazon.com/s?k=Gigabyte+H510M+H+Micro+ATX+LGA1200+Motherboard&tag=bgfg-pc-builder-us-20
ASRock Z890M Riptide WiFi Micro ATX LGA1851 Motherboard,,$259.99,LGA1851,Micro ATX,256 GB,4,https://www.amazon.com/dp/B0DJPTBCD6?tag=bgfg-pc-builder-us-20
