name,rating,price,socket/cpu,form factor,memory max,memory slots,link
Asus ProArt Z790-CREATOR WIFI ATX LGA1700 Motherboard,,$469.99,LGA1700,ATX,128 GB,4,https://www.amazon.com/s?k=Asus+ProArt+Z790-CREATOR+WIFI+ATX+LGA1700+Motherboard&tag=bgfg-pc-builder-us-20
ASRock H670 Steel Legend ATX LGA1700 Motherboard,4.0,$168.75,LGA1700,ATX,128 GB,4,https://www.amazon.com/dp/B09QFV15T9?tag=bgfg-pc-builder-us-20
Asus PRIME B450-PLUS ATX AM4 Motherboard,4.3,$199.90,AM4,ATX,64 GB,4,https://www.amazon.com/dp/B07FKT5CTH?tag=bgfg-pc-builder-us-20
Asus PRIME B550M-K Micro ATX AM4 Motherboard,3.0,$143.21,AM4,Micro ATX,128 GB,4,https://www.amazon.com/dp/B07WJ371HH?tag=bgfg-pc-builder-us-20
Supermicro MBD-X10DAX EATX Dual-CPU LGA2011-3 Motherboard,5.0,$865.25,2 x LGA2011-3,EATX,2000 GB,16,https://www.amazon.com/dp/B00Q6DO9RA?tag=bgfg-pc-builder-us-20
Gigabyte Z390 AORUS PRO WIFI ATX LGA1151 Motherboard,4.7,$348.68,LGA1151,ATX,128 GB,4,https://www.amazon.com/dp/B07HRZKPXM?tag=bgfg-pc-builder-us-20
ASRock B650 LiveMixer ATX AM5 Motherboard,,$229.99,AM5,ATX,128 GB,4,https://www.amazon.com/s?k=ASRock+B650+LiveMixer+ATX+AM5+Motherboard&tag=bgfg-pc-builder-us-20
Gigabyte Z790 AORUS ELITE AX ICE ATX LGA1700 Motherboard,,$259.99,LGA1700,ATX,192 GB,4,https://www.amazon.com/dp/B0CKS6BMH7?tag=bgfg-pc-builder-us-20
ASRock B760M-ITX/D4 WiFi Mini ITX LGA1700 Motherboard,,$232.36,LGA1700,Mini ITX,64 GB,2,https://www.amazon.com/dp/B0BQWQ9QPK?tag=bgfg-pc-builder-us-20
Gigabyte X670E AORUS PRO X ATX AM5 Motherboard,,$329.99,AM5,ATX,192 GB,4,https://www.amazon.com/dp/B0CN76TH9S?tag=bgfg-pc-builder-us-20
Asus ProArt Z890-CREATOR WIFI ATX LGA1851 Motherboard,,$526.35,LGA1851,ATX,192 GB,4,https://www.amazon.com/dp/B0DGW9S82G?tag=bgfg-pc-builder-us-20
ASRock H510M-HDV/M.2 SE Micro ATX LGA1200 Motherboard,,$69.98,LGA1200,Micro ATX,64 GB,2,https://www.amazon.com/dp/B0CBNPY8BM?tag=bgfg-pc-builder-us-20
Asus ROG MAXIMUS Z790 HERO ATX LGA1700 Motherboard,4.5,$799.99,LGA1700,ATX,128 GB,4,https://www.amazon.com/dp/B0BG6M53DG?tag=bgfg-pc-builder-us-20
ASRock B450 Pro4 R2.0 ATX AM4 Motherboard,5.0,$124.95,AM4,ATX,128 GB,4,https://www.amazon.com/dp/B08YX38PCV?tag=bgfg-pc-builder-us-20
MSI PRO B760-VC WIFI IV ATX LGA1700 Motherboard,,,LGA1700,ATX,256 GB,4,https://www.amazon.com/s?k=MSI+PRO+B760-VC+WIFI+IV+ATX+LGA1700+Motherboard&tag=bgfg-pc-builder-us-20
Gigabyte H610M K DDR4 Micro ATX LGA1700 Motherboard,,,LGA1700,Micro ATX,64 GB,2,https://www.amazon.com/s?k=Gigabyte+H610M+K+DDR4+Micro+ATX+LGA1700+Motherboard&tag=bgfg-pc-builder-us-20
ASRock X570 Phantom Gaming 4 ATX AM4 Motherboard,4.4,$154.99,AM4,ATX,128 GB,4,https://www.amazon.com/dp/B07TGHV63W?tag=bgfg-pc-builder-us-20
Asus ROG MAXIMUS Z890 HERO ATX LGA1851 Motherboard,,$692.17,LGA1851,ATX,192 GB,4,https://www.amazon.com/dp/B0DGWWRTPV?tag=bgfg-pc-builder-us-20
MSI MAG B760M MORTAR WIFI II Micro ATX LGA1700 Motherboard,5.0,$199.59,LGA1700,Micro ATX,192 GB,4,https://www.amazon.com/dp/B0CMJP2NNR?tag=bgfg-pc-builder-us-20
Gigabyte A520 AORUS ELITE ATX AM4 Motherboard,5.0,,AM4,ATX,128 GB,4,https://www.amazon.com/s?k=Gigabyte+A520+AORUS+ELITE+ATX+AM4+Motherboard&tag=bgfg-pc-builder-us-20
ASRock B650E Taichi Lite EATX AM5 Motherboard,,$279.99,AM5,EATX,192 GB,4,https://www.amazon.com/s?k=ASRock+B650E+Taichi+Lite+EATX+AM5+Motherboard&tag=bgfg-pc-builder-us-20
MSI X99A GODLIKE GAMING CARBON EATX LGA2011-3 Motherboard,4.7,,LGA2011-3,EATX,128 GB,8,https://www.amazon.com/s?k=MSI+X99A+GODLIKE+GAMING+CARBON+EATX+LGA2011-3+Motherboard&tag=bgfg-pc-builder-us-20
Asus TUF GAMING B450-PLUS II ATX AM4 Motherboard,4.0,$119.99,AM4,ATX,128 GB,4,https://www.amazon.com/dp/B08LCP4N8Q?tag=bgfg-pc-builder-us-20
Asus ROG MAXIMUS Z790 FORMULA ATX LGA1700 Motherboard,,$749.99,LGA1700,ATX,192 GB,4,https://www.amazon.com/dp/B0CJMVW7FV?tag=bgfg-pc-builder-us-20
Gigabyte B450 AORUS PRO WIFI (rev. 1.0) ATX AM4 Motherboard,4.3,$186.86,AM4,ATX,64 GB,4,https://www.amazon.com/dp/B07FW85VFT?tag=bgfg-pc-builder-us-20
Gigabyte H610I Mini ITX LGA1700 Motherboard,,$119.99,LGA1700,Mini ITX,64 GB,2,https://www.amazon.com/dp/B0C4CB8G8D?tag=bgfg-pc-builder-us-20
Gigabyte B760 AORUS ELITE AX ATX LGA1700 Motherboard,,$179.99,LGA1700,ATX,128 GB,4,https://www.amazon.com/dp/B0BSB6MZ2L?tag=bgfg-pc-builder-us-20
MSI B450 TOMAHAWK MAX II ATX AM4 Motherboard,4.5,$114.99,AM4,ATX,128 GB,4,https://www.amazon.com/dp/B07WF6ZQST?tag=bgfg-pc-builder-us-20
ASRock B550M Steel Legend Micro ATX AM4 Motherboard,4.6,$121.98,AM4,Micro ATX,128 GB,4,https://www.amazon.com/dp/B089W2Q2QC?tag=bgfg-pc-builder-us-20
MSI B350 TOMAHAWK ARCTIC ATX AM4 Motherboard,4.3,,AM4,ATX,64 GB,4,https://www.amazon.com/s?k=MSI+B350+TOMAHAWK+ARCTIC+ATX+AM4+Motherboard&tag=bgfg-pc-builder-us-20
MSI PRO Z690-A WIFI ATX LGA1700 Motherboard,,$214.99,LGA1700,ATX,128 GB,4,https://www.amazon.com/dp/B09KKYXXQB?tag=bgfg-pc-builder-us-20
Asus ROG STRIX Z690-A GAMING WIFI D4 ATX LGA1700 Motherboard,4.8,$309.99,LGA1700,ATX,128 GB,4,https://www.amazon.com/dp/B09J1RM86X?tag=bgfg-pc-builder-us-20
ASRock B550 Phantom Gaming-ITX/ax Mini ITX AM4 Motherboard,4.4,$229.99,AM4,Mini ITX,64 GB,2,https://www.amazon.com/dp/B089VRZ6JX?tag=bgfg-pc-builder-us-20
ASRock B850M Pro-A Micro ATX AM5 Motherboard,,$183.24,AM5,Micro ATX,256 GB,4,https://www.amazon.com/dp/B0DS6LMZ84?tag=bgfg-pc-builder-us-20
ASRock H310CM-DVS Micro ATX LGA1151 Motherboard,,$67.15,LGA1151,Micro ATX,32 GB,2,https://www.amazon.com/dp/B07G6MP3LC?tag=bgfg-pc-builder-us-20
Gigabyte A620M S2H Micro ATX AM5 Motherboard,,$79.98,AM5,Micro ATX,96 GB,2,https://www.amazon.com/dp/B0C4CKFV65?tag=bgfg-pc-builder-us-20
Asus ROG STRIX X570-E GAMING WIFI II ATX AM4 Motherboard,4.4,$299.99,AM4,ATX,128 GB,4,https://www.amazon.com/dp/B09GP7V2W5?tag=bgfg-pc-builder-us-20
Asus TUF GAMING A620-PRO WIFI ATX AM5 Motherboard,,,AM5,ATX,192 GB,4,https://www.amazon.com/s?k=Asus+TUF+GAMING+A620-PRO+WIFI+ATX+AM5+Motherboard&tag=bgfg-pc-builder-us-20
Asus PRIME Z270-A ATX LGA1151 Motherboard,4.9,$209.99,LGA1151,ATX,64 GB,4,https://www.amazon.com/dp/B01NGTYV2Q?tag=bgfg-pc-builder-us-20
ASRock X570 Phantom Gaming 4S ATX AM4 Motherboard,4.8,,AM4,ATX,128 GB,4,https://www.amazon.com/s?k=ASRock+X570+Phantom+Gaming+4S+ATX+AM4+Motherboard&tag=bgfg-pc-builder-us-20
Asus ROG STRIX B550-F GAMING (WI-FI) ATX AM4 Motherboard,4.7,$349.99,AM4,ATX,128 GB,4,https://www.amazon.com/dp/B088VSTS9H?tag=bgfg-pc-builder-us-20
Asus ROG STRIX Z890-A GAMING WIFI ATX LGA1851 Motherboard,,$349.99,LGA1851,ATX,192 GB,4,https://www.amazon.com/dp/B0DGWHZKMC?tag=bgfg-pc-builder-us-20
Asus ROG STRIX Z690-I GAMING WIFI Mini ITX LGA1700 Motherboard,4.5,$399.99,LGA1700,Mini ITX,64 GB,2,https://www.amazon.com/dp/B09JRW7FFK?tag=bgfg-pc-builder-us-20
MSI B850 GAMING PLUS WIFI ATX AM5 Motherboard,,$219.93,AM5,ATX,256 GB,4,https://www.amazon.com/dp/B0DQBT2DZ8?tag=bgfg-pc-builder-us-20
MSI MPG Z790I EDGE WIFI Mini ITX LGA1700 Motherboard,3.0,$359.99,LGA1700,Mini ITX,64 GB,2,https://www.amazon.com/s?k=MSI+MPG+Z790I+EDGE+WIFI+Mini+ITX+LGA1700+Motherboard&tag=bgfg-pc-builder-us-20
Gigabyte B650M S2H Micro ATX AM5 Motherboard,,,AM5,Micro ATX,96 GB,2,https://www.amazon.com/s?k=Gigabyte+B650M+S2H+Micro+ATX+AM5+Motherboard&tag=bgfg-pc-builder-us-20
MSI H510M-A PRO Micro ATX LGA1200 Motherboard,4.5,$79.98,LGA1200,Micro ATX,64 GB,2,https://www.amazon.com/dp/B08WBYHQLM?tag=bgfg-pc-builder-us-20
MSI B450-A PRO MAX ATX AM4 Motherboard,4.6,$159.99,AM4,ATX,64 GB,4,https://www.amazon.com/dp/B07XPZMKQ6?tag=bgfg-pc-builder-us-20
ASRock B450M Steel Legend Micro ATX AM4 Motherboard,4.4,$149.99,AM4,Micro ATX,64 GB,4,https://www.amazon.com/dp/B07MV9BMNY?tag=bgfg-pc-builder-us-20
ASRock B850 Riptide WiFi ATX AM5 Motherboard,,$219.99,AM5,ATX,256 GB,4,https://www.amazon.com/dp/B0DS6MNSWT?tag=bgfg-pc-builder-us-20
MSI MAG B760 TOMAHAWK WIFI DDR4 ATX LGA1700 Motherboard,,$199.99,LGA1700,ATX,128 GB,4,https://www.amazon.com/dp/B0BP94WCFL?tag=bgfg-pc-builder-us-20
ASRock 970M PRO3 Micro ATX AM3+/AM3 Motherboard,4.1,,AM3+/AM3,Micro ATX,64 GB,4,https://www.amazon.com/s?k=ASRock+970M+PRO3+Micro+ATX+AM3%2B%2FAM3+Motherboard&tag=bgfg-pc-builder-us-20
MSI A320M-A PRO MAX Micro ATX AM4 Motherboard,4.1,,AM4,Micro ATX,32 GB,2,https://www.amazon.com/s?k=MSI+A320M-A+PRO+MAX+Micro+ATX+AM4+Motherboard&tag=bgfg-pc-builder-us-20
Asus P5QL-VM DO/CSM Micro ATX LGA775 Motherboard,4.5,,LGA775,Micro ATX,16 GB,4,https://www.amazon.com/s?k=Asus+P5QL-VM+DO%2FCSM+Micro+ATX+LGA775+Motherboard&tag=bgfg-pc-builder-us-20
Asus PRIME X570-P ATX AM4 Motherboard,4.3,$201.95,AM4,ATX,128 GB,4,https://www.amazon.com/dp/B07SW925DR?tag=bgfg-pc-builder-us-20
MSI MAG X570S TOMAHAWK MAX WIFI ATX AM4 Motherboard,5.0,$229.99,AM4,ATX,128 GB,4,https://www.amazon.com/dp/B09BGWJD3C?tag=bgfg-pc-builder-us-20
ASRock B650M PG RIPTIDE Micro ATX AM5 Motherboard,4.0,$200.99,AM5,Micro ATX,128 GB,4,https://www.amazon.com/dp/B0BHYV43QV?tag=bgfg-pc-builder-us-20
ASRock A320M-HDV R4.0 Micro ATX AM4 Motherboard,4.5,$114.86,AM4,Micro ATX,32 GB,2,https://www.amazon.com/dp/B07MNSP7PB?tag=bgfg-pc-builder-us-20
MSI MEG X670E ACE EATX AM5 Motherboard,,$689.99,AM5,EATX,128 GB,4,https://www.amazon.com/s?k=MSI+MEG+X670E+ACE+EATX+AM5+Motherboard&tag=bgfg-pc-builder-us-20
Gigabyte GA-A320M-S2H Micro ATX AM4 Motherboard,3.8,$55.33,AM4,Micro ATX,32 GB,2,https://www.amazon.com/dp/B079NYQQJJ?tag=bgfg-pc-builder-us-20
Gigabyte X570 AORUS ELITE WIFI ATX AM4 Motherboard,4.4,$151.56,AM4,ATX,128 GB,4,https://www.amazon.com/dp/B07WL5MFXL?tag=bgfg-pc-builder-us-20
Asus ROG STRIX B550-I GAMING Mini ITX AM4 Motherboard,4.3,$272.04,AM4,Mini ITX,64 GB,2,https://www.amazon.com/dp/B089D34SZT?tag=bgfg-pc-builder-us-20
MSI MPG Z490 GAMING EDGE WIFI ATX LGA1200 Motherboard,4.5,$149.49,LGA1200,ATX,128 GB,4,https://www.amazon.com/dp/B0876J8436?tag=bgfg-pc-builder-us-20
MSI MAG X870E TOMAHAWK WIFI ATX AM5 Motherboard,,,AM5,ATX,256 GB,4,https://www.amazon.com/s?k=MSI+MAG+X870E+TOMAHAWK+WIFI+ATX+AM5+Motherboard&tag=bgfg-pc-builder-us-20
MSI MAG B550M MORTAR MAX WIFI Micro ATX AM4 Motherboard,,,AM4,Micro ATX,128 GB,4,https://www.amazon.com/s?k=MSI+MAG+B550M+MORTAR+MAX+WIFI+Micro+ATX+AM4+Motherboard&tag=bgfg-pc-builder-us-20
ASRock X570 Phantom Gaming-ITX/TB3 Mini ITX AM4 Motherboard,3.7,$268.87,AM4,Mini ITX,64 GB,2,https://www.amazon.com/dp/B07VXYYG7F?tag=bgfg-pc-builder-us-20
ASRock Fatal1ty B450 Gaming-ITX/ac Mini ITX AM4 Motherboard,4.6,$165.99,AM4,Mini ITX,64 GB,2,https://www.amazon.com/dp/B07FVVNDFX?tag=bgfg-pc-builder-us-20
Asus PRIME B660-PLUS D4 ATX LGA1700 Motherboard,4.0,$139.99,LGA1700,ATX,128 GB,4,https://www.amazon.com/dp/B09NWDQ1TH?tag=bgfg-pc-builder-us-20
MSI A520M PRO Micro ATX AM4 Motherboard,,$105.74,AM4,Micro ATX,64 GB,2,https://www.amazon.com/dp/B08HKJ45DR?tag=bgfg-pc-builder-us-20
MSI MPG Z390 GAMING EDGE AC ATX LGA1151 Motherboard,4.8,,LGA1151,ATX,128 GB,4,https://www.amazon.com/s?k=MSI+MPG+Z390+GAMING+EDGE+AC+ATX+LGA1151+Motherboard&tag=bgfg-pc-builder-us-20
Asus TUF GAMING B550M-PLUS Micro ATX AM4 Motherboard,4.4,$199.99,AM4,Micro ATX,128 GB,4,https://www.amazon.com/dp/B088W66DQ7?tag=bgfg-pc-builder-us-20
Asus PRIME H610M-K D4 Micro ATX LGA1700 Motherboard,4.0,$117.76,LGA1700,Micro ATX,64 GB,2,https://www.amazon.com/s?k=Asus+PRIME+H610M-K+D4+Micro+ATX+LGA1700+Motherboard&tag=bgfg-pc-builder-us-20
MSI MAG Z690 TOMAHAWK WIFI DDR4 ATX LGA1700 Motherboard,4.9,$249.99,LGA1700,ATX,128 GB,4,https://www.amazon.com/dp/B09GLD72QH?tag=bgfg-pc-builder-us-20
Gigabyte B450 AORUS ELITE ATX AM4 Motherboard,4.5,$121.04,AM4,ATX,64 GB,4,https://www.amazon.com/dp/B07GRNSWNR?tag=bgfg-pc-builder-us-20
MSI MPG X570 GAMING PLUS ATX AM4 Motherboard,4.4,$144.05,AM4,ATX,128 GB,4,https://www.amazon.com/dp/B07T5QDRFX?tag=bgfg-pc-builder-us-20
Asus TUF GAMING X570-PRO WIFI II ATX AM4 Motherboard,5.0,$229.99,AM4,ATX,128 GB,4,https://www.amazon.com/dp/B09HDR1D7Z?tag=bgfg-pc-builder-us-20
ASRock B650M PG Lightning Micro ATX AM5 Motherboard,,,AM5,Micro ATX,192 GB,4,https://www.amazon.com/s?k=ASRock+B650M+PG+Lightning+Micro+ATX+AM5+Motherboard&tag=bgfg-pc-builder-us-20
Gigabyte B365M DS3H WIFI Micro ATX LGA1151 Motherboard,5.0,,LGA1151,Micro ATX,64 GB,4,https://www.amazon.com/s?k=Gigabyte+B365M+DS3H+WIFI+Micro+ATX+LGA1151+Motherboard&tag=bgfg-pc-builder-us-20
ASRock Z890I Nova WiFi Mini ITX LGA1851 Motherboard,,,LGA1851,Mini ITX,128 GB,2,https://www.amazon.com/s?k=ASRock+Z890I+Nova+WiFi+Mini+ITX+LGA1851+Motherboard&tag=bgfg-pc-builder-us-20
MSI PRO B760M-P Micro ATX LGA1700 Motherboard,,,LGA1700,Micro ATX,192 GB,4,https://www.amazon.com/s?k=MSI+PRO+B760M-P+Micro+ATX+LGA1700+Motherboard&tag=bgfg-pc-builder-us-20
Gigabyte H610M S2H Micro ATX LGA1700 Motherboard,,$89.99,LGA1700,Micro ATX,64 GB,2,https://www.amazon.com/dp/B0BZQ416QM?tag=bgfg-pc-builder-us-20
MSI Z490-A PRO ATX LGA1200 Motherboard,4.7,$149.99,LGA1200,ATX,128 GB,4,https://www.amazon.com/dp/B0886R2VJW?tag=bgfg-pc-builder-us-20
MSI B760 GAMING PLUS WIFI DDR4 ATX LGA1700 Motherboard,,,LGA1700,ATX,128 GB,4,https://www.amazon.com/s?k=MSI+B760+GAMING+PLUS+WIFI+DDR4+ATX+LGA1700+Motherboard&tag=bgfg-pc-builder-us-20
Asus PRIME-H610M-A-WIFI-D4 Micro ATX LGA1700 Motherboard,,,LGA1700,Micro ATX,64 GB,2,https://www.amazon.com/s?k=Asus+PRIME-H610M-A-WIFI-D4+Micro+ATX+LGA1700+Motherboard&tag=bgfg-pc-builder-us-20
Gigabyte B450 AORUS M Micro ATX AM4 Motherboard,4.6,$169.99,AM4,Micro ATX,64 GB,4,https://www.amazon.com/dp/B07FWY246F?tag=bgfg-pc-builder-us-20
Asus PRIME B760-PLUS D4 ATX LGA1700 Motherboard,,$159.99,LGA1700,ATX,128 GB,4,https://www.amazon.com/dp/B0BR8TRM93?tag=bgfg-pc-builder-us-20
Asus TUF GAMING Z690-PLUS WIFI D4 ATX LGA1700 Motherboard,4.7,$219.99,LGA1700,ATX,128 GB,4,https://www.amazon.com/dp/B09J1S2LDS?tag=bgfg-pc-builder-us-20
Gigabyte TRX40 DESIGNARE XL ATX sTRX4 Motherboard,,$1449.99,sTRX4,XL ATX,256 GB,8,https://www.amazon.com/dp/B081YW31GR?tag=bgfg-pc-builder-us-20
Gigabyte B850 GAMING WIFI6 ATX AM5 Motherboard,,$179.99,AM5,ATX,256 GB,4,https://www.amazon.com/dp/B0DQLKZSKF?tag=bgfg-pc-builder-us-20
ASRock Z690 PG Velocita ATX LGA1700 Motherboard,,$309.99,LGA1700,ATX,128 GB,4,https://www.amazon.com/dp/B09JM86C21?tag=bgfg-pc-builder-us-20
ASRock B650E PG RIPTIDE WIFI ATX AM5 Motherboard,,$271.37,AM5,ATX,128 GB,4,https://www.amazon.com/dp/B0BHDR53BR?tag=bgfg-pc-builder-us-20
Gigabyte X570 AORUS ELITE ATX AM4 Motherboard,4.4,$169.99,AM4,ATX,128 GB,4,https://www.amazon.com/dp/B07SVRZGMX?tag=bgfg-pc-builder-us-20
Asus PRIME B760M-A WIFI D4 Micro ATX LGA1700 Motherboard,,,LGA1700,Micro ATX,128 GB,4,https://www.amazon.com/s?k=Asus+PRIME+B760M-A+WIFI+D4+Micro+ATX+LGA1700+Motherboard&tag=bgfg-pc-builder-us-20
Asus PRIME A620M-A-CSM Micro ATX AM5 Motherboard,,$129.99,AM5,Micro ATX,128 GB,4,https://www.amazon.com/dp/B0C3ZLCSVP?tag=bgfg-pc-builder-us-20
Asus TUF GAMING Z890-PLUS WIFI ATX LGA1851 Motherboard,,$279.99,LGA1851,ATX,192 GB,4,https://www.amazon.com/dp/B0DGWNVCHL?tag=bgfg-pc-builder-us-20
ASRock B850M Steel Legend WiFi Micro ATX AM5 Motherboard,,,AM5,Micro ATX,256 GB,4,https://www.amazon.com/s?k=ASRock+B850M+Steel+Legend+WiFi+Micro+ATX+AM5+Motherboard&tag=bgfg-pc-builder-us-20
Gigabyte Z890M AORUS ELITE WIFI7 ICE Micro ATX LGA1851 Motherboard,,$239.99,LGA1851,Micro ATX,256 GB,4,https://www.amazon.com/dp/B0DJP8Q6JK?tag=bgfg-pc-builder-us-20
Asus TUF GAMING B450M-PLUS II Micro ATX AM4 Motherboard,3.8,$155.00,AM4,Micro ATX,128 GB,4,https://www.amazon.com/dp/B08KGXBNLR?tag=bgfg-pc-builder-us-20
Asus PRIME B550-PLUS AC-HES ATX AM4 Motherboard,,,AM4,ATX,128 GB,4,https://www.amazon.com/s?k=Asus+PRIME+B550-PLUS+AC-HES+ATX+AM4+Motherboard&tag=bgfg-pc-builder-us-20
MSI PRO B650M-B Micro ATX AM5 Motherboard,,,AM5,Micro ATX,96 GB,2,https://www.amazon.com/s?k=MSI+PRO+B650M-B+Micro+ATX+AM5+Motherboard&tag=bgfg-pc-builder-us-20
Gigabyte GA-P35-DS3L ATX LGA775 Motherboard,4.0,,LGA775,ATX,8 GB,4,https://www.amazon.com/s?k=Gigabyte+GA-P35-DS3L+ATX+LGA775+Motherboard&tag=bgfg-pc-builder-us-20
Asus TUF GAMING Z790-PRO WIFI ATX LGA1700 Motherboard,,$279.99,LGA1700,ATX,192 GB,4,https://www.amazon.com/dp/B0CJMVSRVF?tag=bgfg-pc-builder-us-20
Gigabyte B450M DS3H Micro ATX AM4 Motherboard,4.0,$77.98,AM4,Micro ATX,64 GB,4,https://www.amazon.com/dp/B07FWVJSHC?tag=bgfg-pc-builder-us-20
Asus PRIME A520M-K Micro ATX AM4 Motherboard,,$73.98,AM4,Micro ATX,64 GB,2,https://www.amazon.com/dp/B08DKN11JD?tag=bgfg-pc-builder-us-20
Gigabyte B650M GAMING X AX Micro ATX AM5 Motherboard,,,AM5,Micro ATX,128 GB,4,https://www.amazon.com/s?k=Gigabyte+B650M+GAMING+X+AX+Micro+ATX+AM5+Motherboard&tag=bgfg-pc-builder-us-20
ASRock B450M Pro4 Micro ATX AM4 Motherboard,4.6,,AM4,Micro ATX,64 GB,4,https://www.amazon.com/s?k=ASRock+B450M+Pro4+Micro+ATX+AM4+Motherboard&tag=bgfg-pc-builder-us-20
ASRock B550M-HDV Micro ATX AM4 Motherboard,5.0,$72.99,AM4,Micro ATX,64 GB,2,https://www.amazon.com/dp/B089W26FCB?tag=bgfg-pc-builder-us-20
Asus TUF GAMING A620M-PLUS WIFI Micro ATX AM5 Motherboard,,$149.99,AM5,Micro ATX,128 GB,4,https://www.amazon.com/dp/B0C3ZPLNTH?tag=bgfg-pc-builder-us-20
NZXT N7 Z790 ATX LGA1700 Motherboard,,,LGA1700,ATX,128 GB,4,https://www.amazon.com/s?k=NZXT+N7+Z790+ATX+LGA1700+Motherboard&tag=bgfg-pc-builder-us-20
Asus ROG STRIX X670E-A GAMING WIFI ATX AM5 Motherboard,,$419.99,AM5,ATX,128 GB,4,https://www.amazon.com/s?k=Asus+ROG+STRIX+X670E-A+GAMING+WIFI+ATX+AM5+Motherboard&tag=bgfg-pc-builder-us-20
Gigabyte B550 AORUS ELITE V2 ATX AM4 Motherboard,4.2,$258.86,AM4,ATX,128 GB,4,https://www.amazon.com/dp/B08JHDL4WP?tag=bgfg-pc-builder-us-20
MSI Z790 GAMING PLUS WIFI ATX LGA1700 Motherboard,,,LGA1700,ATX,192 GB,4,https://www.amazon.com/s?k=MSI+Z790+GAMING+PLUS+WIFI+ATX+LGA1700+Motherboard&tag=bgfg-pc-builder-us-20
Asus ROG MAXIMUS Z890 EXTREME EATX LGA1851 Motherboard,,$985.77,LGA1851,EATX,192 GB,4,https://www.amazon.com/dp/B0DGWKQCKH?tag=bgfg-pc-builder-us-20
MSI MPG B650 EDGE WIFI ATX AM5 Motherboard,,$289.99,AM5,ATX,128 GB,4,https://www.amazon.com/s?k=MSI+MPG+B650+EDGE+WIFI+ATX+AM5+Motherboard&tag=bgfg-pc-builder-us-20
ASRock H610M-HVS Micro ATX LGA1700 Motherboard,,$90.99,LGA1700,Micro ATX,64 GB,2,https://www.amazon.com/dp/B09QFVDD29?tag=bgfg-pc-builder-us-20
ASRock B550M PG RIPTIDE Micro ATX AM4 Motherboard,,$89.99,AM4,Micro ATX,128 GB,4,https://www.amazon.com/s?k=ASRock+B550M+PG+RIPTIDE+Micro+ATX+AM4+Motherboard&tag=bgfg-pc-builder-us-20
MSI MEG X670E GODLIKE EATX AM5 Motherboard,,$1299.99,AM5,EATX,128 GB,4,https://www.amazon.com/s?k=MSI+MEG+X670E+GODLIKE+EATX+AM5+Motherboard&tag=bgfg-pc-builder-us-20
Asus PRIME H510M-K Micro ATX LGA1200 Motherboard,5.0,$109.85,LGA1200,Micro ATX,64 GB,2,https://www.amazon.com/s?k=Asus+PRIME+H510M-K+Micro+ATX+LGA1200+Motherboard&tag=bgfg-pc-builder-us-20
MSI Z390-A PRO ATX LGA1151 Motherboard,4.4,$398.00,LGA1151,ATX,128 GB,4,https://www.amazon.com/dp/B07J6Z9KJ2?tag=bgfg-pc-builder-us-20
MSI B450 TOMAHAWK ATX AM4 Motherboard,4.7,$198.86,AM4,ATX,64 GB,4,https://www.amazon.com/dp/B07F7W5KJS?tag=bgfg-pc-builder-us-20
Gigabyte B760M DS3H AX Micro ATX LGA1700 Motherboard,,$139.99,LGA1700,Micro ATX,128 GB,4,https://www.amazon.com/dp/B0BSP61QZC?tag=bgfg-pc-builder-us-20
Asus TUF GAMING B650-PLUS ATX AM5 Motherboard,4.0,,AM5,ATX,128 GB,4,https://www.amazon.com/s?k=Asus+TUF+GAMING+B650-PLUS+ATX+AM5+Motherboard&tag=bgfg-pc-builder-us-20
MSI MPG Z790 EDGE TI MAX WIFI ATX LGA1700 Motherboard,4.0,$389.99,LGA1700,ATX,192 GB,4,https://www.amazon.com/dp/B0CJS34SLJ?tag=bgfg-pc-builder-us-20
Asus PRIME X670E-PRO WIFI ATX AM5 Motherboard,,$349.99,AM5,ATX,128 GB,4,https://www.amazon.com/s?k=Asus+PRIME+X670E-PRO+WIFI+ATX+AM5+Motherboard&tag=bgfg-pc-builder-us-20
Asus PRIME Z390-P ATX LGA1151 Motherboard,4.2,$235.00,LGA1151,ATX,128 GB,4,https://www.amazon.com/dp/B07HCT5GBD?tag=bgfg-pc-builder-us-20
ASRock B450 Steel Legend ATX AM4 Motherboard,4.5,$104.99,AM4,ATX,64 GB,4,https://www.amazon.com/dp/B07MV7LR1B?tag=bgfg-pc-builder-us-20
MSI MPG Z790 EDGE WIFI ATX LGA1700 Motherboard,,$369.99,LGA1700,ATX,128 GB,4,https://www.amazon.com/s?k=MSI+MPG+Z790+EDGE+WIFI+ATX+LGA1700+Motherboard&tag=bgfg-pc-builder-us-20
Asus TUF GAMING B760-PLUS WIFI ATX LGA1700 Motherboard,,$214.99,LGA1700,ATX,128 GB,4,https://www.amazon.com/s?k=Asus+TUF+GAMING+B760-PLUS+WIFI+ATX+LGA1700+Motherboard&tag=bgfg-pc-builder-us-20
Gigabyte B850M GAMING X WIFI6E Micro ATX AM5 Motherboard,,$179.99,AM5,Micro ATX,256 GB,4,https://www.amazon.com/dp/B0DQLHLVLK?tag=bgfg-pc-builder-us-20
MSI MAG Z790 TOMAHAWK MAX WIFI ATX LGA1700 Motherboard,,$274.99,LGA1700,ATX,192 GB,4,https://www.amazon.com/dp/B0CJSL89T2?tag=bgfg-pc-builder-us-20
Gigabyte Z790 AORUS ELITE X WIFI7 ATX LGA1700 Motherboard,,$349.70,LGA1700,ATX,192 GB,4,https://www.amazon.com/dp/B0CJQDSZN2?tag=bgfg-pc-builder-us-20
ASRock B850M Pro-A WiFi Micro ATX AM5 Motherboard,,,AM5,Micro ATX,256 GB,4,https://www.amazon.com/s?k=ASRock+B850M+Pro-A+WiFi+Micro+ATX+AM5+Motherboard&tag=bgfg-pc-builder-us-20
MSI MPG X670E CARBON WIFI ATX AM5 Motherboard,,$479.99,AM5,ATX,128 GB,4,https://www.amazon.com/s?k=MSI+MPG+X670E+CARBON+WIFI+ATX+AM5+Motherboard&tag=bgfg-pc-builder-us-20
ASRock B660M-HDV Micro ATX LGA1700 Motherboard,4.0,$107.99,LGA1700,Micro ATX,64 GB,2,https://www.amazon.com/dp/B09NZDGH1W?tag=bgfg-pc-builder-us-20
MSI Z790 PROJECT ZERO ATX LGA1700 Motherboard,,$249.99,LGA1700,ATX,256 GB,4,https://www.amazon.com/dp/B0CRF7JJWZ?tag=bgfg-pc-builder-us-20
Gigabyte Z790M AORUS ELITE AX ICE Micro ATX LGA1700 Motherboard,,,LGA1700,Micro ATX,192 GB,4,https://www.amazon.com/s?k=Gigabyte+Z790M+AORUS+ELITE+AX+ICE+Micro+ATX+LGA1700+Motherboard&tag=bgfg-pc-builder-us-20
Gigabyte B760I AORUS PRO Mini ITX LGA1700 Motherboard,5.0,$261.80,LGA1700,Mini ITX,96 GB,2,https://www.amazon.com/dp/B0C4ZRR7Q1?tag=bgfg-pc-builder-us-20
ASRock B850 Steel Legend WiFi ATX AM5 Motherboard,5.0,$209.99,AM5,ATX,256 GB,4,https://www.amazon.com/dp/B0DRTTJ5D6?tag=bgfg-pc-builder-us-20
MSI PRO Z690-A DDR4 ATX LGA1700 Motherboard,4.1,$194.99,LGA1700,ATX,128 GB,4,https://www.amazon.com/dp/B09GLD6LYW?tag=bgfg-pc-builder-us-20
Gigabyte B450 AORUS ELITE V2 ATX AM4 Motherboard,4.4,$118.85,AM4,ATX,128 GB,4,https://www.amazon.com/dp/B08LG2JC4B?tag=bgfg-pc-builder-us-20
ASRock Z690 Steel Legend ATX LGA1700 Motherboard,,$162.99,LGA1700,ATX,128 GB,4,https://www.amazon.com/dp/B09JM6L6MH?tag=bgfg-pc-builder-us-20
MSI B840 GAMING PLUS WIFI ATX AM5 Motherboard,,$191.59,AM5,ATX,256 GB,4,https://www.amazon.com/dp/B0DQB3RC4H?tag=bgfg-pc-builder-us-20
Asus PRIME A520M-A II/CSM Micro ATX AM4 Motherboard,,$79.98,AM4,Micro ATX,128 GB,4,https://www.amazon.com/dp/B0997CGDLQ?tag=bgfg-pc-builder-us-20
Asus TUF GAMING B550-PLUS ATX AM4 Motherboard,4.5,$149.99,AM4,ATX,128 GB,4,https://www.amazon.com/dp/B088W57M4J?tag=bgfg-pc-builder-us-20
ASRock B760M PG Riptide Micro ATX LGA1700 Motherboard,,$148.58,LGA1700,Micro ATX,128 GB,4,https://www.amazon.com/dp/B0BQWPTZWD?tag=bgfg-pc-builder-us-20
MSI MEG Z790 GODLIKE MAX EATX LGA1700 Motherboard,,$1196.64,LGA1700,EATX,192 GB,4,https://www.amazon.com/dp/B0CM9V3F2V?tag=bgfg-pc-builder-us-20
ASRock X870E Taichi Lite EATX AM5 Motherboard,,$521.58,AM5,EATX,256 GB,4,https://www.amazon.com/dp/B0DFNPK2MX?tag=bgfg-pc-builder-us-20
ASRock Phantom Gaming X870 Riptide WiFi ATX AM5 Motherboard,,$249.99,AM5,ATX,256 GB,4,https://www.amazon.com/dp/B0DG4K31QP?tag=bgfg-pc-builder-us-20
Asus ROG STRIX Z790-E GAMING WIFI ATX LGA1700 Motherboard,,$499.99,LGA1700,ATX,128 GB,4,https://www.amazon.com/dp/B0BG6KQPWD?tag=bgfg-pc-builder-us-20
Asus PRIME B760-PLUS ATX LGA1700 Motherboard,,,LGA1700,ATX,128 GB,4,https://www.amazon.com/s?k=Asus+PRIME+B760-PLUS+ATX+LGA1700+Motherboard&tag=bgfg-pc-builder-us-20
Supermicro X10SLL-F Micro ATX LGA1150 Motherboard,5.0,$337.99,LGA1150,Micro ATX,32 GB,4,https://www.amazon.com/dp/B00D65V9WO?tag=bgfg-pc-builder-us-20
ASRock B850M Pro RS WiFi Micro ATX AM5 Motherboard,,$159.99,AM5,Micro ATX,256 GB,4,https://www.amazon.com/dp/B0DRTWM32Q?tag=bgfg-pc-builder-us-20
Asus PRIME B660M-A WIFI D4 Micro ATX LGA1700 Motherboard,4.7,$149.99,LGA1700,Micro ATX,128 GB,4,https://www.amazon.com/dp/B09Q3LCN7J?tag=bgfg-pc-builder-us-20
Asus PRIME Z390-A ATX LGA1151 Motherboard,4.6,$269.60,LGA1151,ATX,128 GB,4,https://www.amazon.com/dp/B07HCY7K9L?tag=bgfg-pc-builder-us-20
Asus ROG STRIX Z690-E GAMING WIFI ATX LGA1700 Motherboard,5.0,$399.99,LGA1700,ATX,128 GB,4,https://www.amazon.com/dp/B09JS5DHSX?tag=bgfg-pc-builder-us-20
Gigabyte B650E AORUS STEALTH ICE ATX AM5 Motherboard,,,AM5,ATX,192 GB,4,https://www.amazon.com/s?k=Gigabyte+B650E+AORUS+STEALTH+ICE+ATX+AM5+Motherboard&tag=bgfg-pc-builder-us-20
Asus ROG Crosshair VIII Dark Hero ATX AM4 Motherboard,4.8,$399.99,AM4,ATX,128 GB,4,https://www.amazon.com/dp/B08MTKJ6HM?tag=bgfg-pc-builder-us-20
Asus PRIME Z790-A WIFI ATX LGA1700 Motherboard,4.0,$399.00,LGA1700,ATX,128 GB,4,https://www.amazon.com/dp/B0BG6NVPVG?tag=bgfg-pc-builder-us-20
ASRock B760 Pro RS/D4 ATX LGA1700 Motherboard,,$206.17,LGA1700,ATX,128 GB,4,https://www.amazon.com/dp/B0BQWRCYNX?tag=bgfg-pc-builder-us-20
ASRock B550M Phantom Gaming 4 Micro ATX AM4 Motherboard,,$159.00,AM4,Micro ATX,128 GB,4,https://www.amazon.com/dp/B08MXSQS49?tag=bgfg-pc-builder-us-20
ASRock X670E Steel Legend ATX AM5 Motherboard,,$377.22,AM5,ATX,128 GB,4,https://www.amazon.com/dp/B0BGPCH9C3?tag=bgfg-pc-builder-us-20
Gigabyte TRX40 AORUS XTREME XL ATX sTRX4 Motherboard,,$899.99,sTRX4,XL ATX,256 GB,8,https://www.amazon.com/dp/B081JDP378?tag=bgfg-pc-builder-us-20
MSI MPG Z790 CARBON MAX WIFI II ATX LGA1700 Motherboard,,$409.99,LGA1700,ATX,256 GB,4,https://www.amazon.com/s?k=MSI+MPG+Z790+CARBON+MAX+WIFI+II+ATX+LGA1700+Motherboard&tag=bgfg-pc-builder-us-20
Asus Pro B550M-C/CSM Micro ATX AM4 Motherboard,5.0,$139.30,AM4,Micro ATX,128 GB,4,https://www.amazon.com/dp/B08TMV9FW5?tag=bgfg-pc-builder-us-20
MSI PRO Z790-P WIFI DDR4 ATX LGA1700 Motherboard,5.0,$239.99,LGA1700,ATX,128 GB,4,https://www.amazon.com/dp/B0BHC2LNBF?tag=bgfg-pc-builder-us-20
Gigabyte X870E AORUS XTREME AI TOP EATX AM5 Motherboard,,,AM5,EATX,256 GB,4,https://www.amazon.com/s?k=Gigabyte+X870E+AORUS+XTREME+AI+TOP+EATX+AM5+Motherboard&tag=bgfg-pc-builder-us-20
Asus ProArt X670E-CREATOR WIFI ATX AM5 Motherboard,,$499.99,AM5,ATX,128 GB,4,https://www.amazon.com/dp/B0BDTM7VP5?tag=bgfg-pc-builder-us-20
